tweet,id,last_tweeted,active
I am absolutely shocked at the amount of people who do not investigate what is really in the products they consume.,15527,2024-12-08 12:15:01,1
"FEMA is the Trojan Horse by which the New World Order will implement overt, police-state control over the American populace.",15528,2024-11-19 21:45:01,1
"Much like Jeffrey Epstein, the ruling class needs Assange out of the way. There won't be a testimony because the truth would come out. Just like in Epstein's case: he had too much on too many powerful people.",15529,2024-07-29 06:45:01,1
"""If both the past and the external world exist only in the mind, and if the mind itself is controllable -- what then?"" ~ George Orwell",15530,2024-11-24 20:15:02,1
"Jesus Christ's birthday was NOT on Dec. 25th. Research, people.",15531,2024-09-23 07:45:01,1
"They are everywhere, cleverly disguised... strange symbols, signs, charms, talismans, and handshakes that program and control our minds.",15532,2024-09-02 14:45:01,1
"Nazi Germany had an anti-tobacco movement, their research was silenced after the war.",15533,2024-07-09 04:15:01,1
"The government uses you like lab rats, and you keep believing in the garbage they put in your food and water.",15534,2024-08-18 19:45:01,1
"On the discussion of 9/11... Let's name some proven False Flags?? Shall we?
https://en.wikipedia.org/wiki/False_flag
https://en.wikipedia.org/wiki/Operation_Himmler
https://en.wikipedia.org/wiki/Lavon_Affair
https://en.wikipedia.org/wiki/Operation_Northwoods
https://en.wikipedia.org/wiki/Gleiwitz_incident
https://en.wikipedia.org/wiki/Reichstag_fire
https://en.wikipedia.org/wiki/1953_Iranian_coup_d%27%C3%A9tat
",15537,2024-08-04 22:15:01,1
ensure your deodorant doesn't have aluminum - direct link to alzheimer's.,15538,2024-10-18 04:45:01,1
"There are two governments in America, the government you see and the government you don't see.",15539,2024-12-23 08:15:01,1
A large majority of the world's population do not have a clue as to what is really going on in the world.,15541,2024-11-21 09:45:01,1
"We have all been lied to for a very long time, and I personally am sick and tired of it.",15542,2024-08-01 16:45:02,1
"Is it just me, or are the governments of the world just daring their people to rise up against them?",15543,2024-10-30 02:45:02,1
"Once you become a person of interest, the CIA retains your file indefinitely.",15544,2024-12-09 10:15:01,1
Pedophiles are put into positions of power because they can be completely controlled by elite masters who hold evidence of their pedophilia.,15545,2024-07-16 23:15:01,1
The collapse of Building 7 on 9/11 was later admitted to be a demolition by owner Larry Silverstein on a PBS interview in Sept. 2002.,15546,2024-07-26 16:45:01,1
Deep Military Underground Bases are basically large underground cities connected by high-speed magneto-leviton trains (up to Mach 2 speeds).,15547,2024-10-15 14:15:01,1
"Originally, the Great Seal on the dollar bill was meant for coins. It was Franklin D. Roosevelt who recommended it be put on the dollar.",15549,2024-12-22 15:45:01,1
"Research Secret Societies that were in existence around the time of the rise of Hitler and the Nazis, such as the Thule Society and the Vril Society.",15550,2024-10-15 08:15:01,1
"Hitler and Stalin were commanding armies engaged in long battles with high fatalities on both sides. Meanwhile, unbeknownst to almost the entire world population except for a few insiders, the Nazis are deep into a secret UFO project.",15551,2024-09-11 14:45:01,1
everything you're told is a lie,15552,2024-09-06 16:45:01,1
It is pretty well established that the Nazis had a fascination with the occult and extra-terrestrial technology.,15553,2024-07-14 03:15:01,1
How the Military Ran Its 1970s Psychic Intelligence Program http://www.atlasobscura.com/articles/how-the-military-ran-its-1970s-psychic-intelligence-programmany-memos-naturally,15555,2024-06-24 13:15:01,1
"Project Pegasus is a US black project operated under the Air Force Space Command, that has allegedly achieved successful organic teleportations to the moon and more notably, to Mars. Its success has further claims into time travel.",15556,2024-09-25 08:15:01,1
Andrew Basiago's 1863 Gettysburg Time Travel Photo: https://www.strangerdimensions.com/2017/01/30/andrew-basiagos-1863-gettysburg-time-travel-photo/,15557,2024-10-16 21:15:01,1
project pegasus: time travel and teleportation: https://newearth.media/project-pegasus-time-travel-and-teleportation/,15558,2024-09-21 01:45:01,1
"There are points around the world that mark, like a cursed treasure map, areas where planes, ships, and people seem to vanish without a trace. They're called the 12 Vile Vortices.

You know of at least one of them: The Bermuda Triangle",15559,2024-09-20 06:45:01,1
"Several events immediately preceding the 9/11 attacks suggests many people other than Islamic extremists anticipated the attack. These include extremely large purchases of put options on stocks of American Airlines, United Airlines, and other companies hurt by the attack.",15561,2024-08-14 20:15:01,1
Several events immediately preceding the 9/11 attacks suggests many people other than Islamic extremists anticipated the attack. These include a surge in financial transactions on computers in the World Trade Center on the morning of 9/11.,15562,2024-07-15 10:15:01,1
"Several events immediately preceding the 9/11 attacks suggests many people other than Islamic extremists anticipated the attack. These include avoidance of the airlines and New York City on 9/11 by a number of important people, some admitting to having been warned of an attack.",15563,2024-08-06 21:45:02,1
Several events immediately preceding the 9/11 attacks suggests many people other than Islamic extremists anticipated the attack. These include the behavior of 5 Israelis who appeared to be celebrating the attack on the World Trade Center as they filmed it from across the Hudson.,15564,2024-11-11 17:45:01,1
Several events immediately preceding the 9/11 attacks suggests many people other than Islamic extremists anticipated the attack. These include a warning received by Rudolph Giuliani that the South Tower would collapse ten minutes before the event actually happened.,15565,2024-12-14 04:45:01,1
Our noble public servants would never mislead us or fearmonger about a supposed foreign threat.,15566,2024-12-03 19:15:01,1
You might want to learn how to hunt and fish before SHTF.,15567,2024-09-09 21:15:01,1
It is time to move beyond the charade. It is time to move beyond the falsehoods. It is time to recognize and accept the truth.,15568,2024-09-15 22:45:01,1
"The notion that Francis Bacon was really the one behind Shakespeare's writings is strongly supported by modern cipher sleuthing, including my own.",15571,2024-09-04 21:45:01,1
"Rosicrucians, Ciphers and Francis Bacon the real author of Shakespeare's Works? https://rosicruciansinportlandoregonwilsonville.com/2019/05/13/rosicrucians-ciphers-and-francis-bacon-the-real-author-of-shakespeares-works/",15572,2024-09-06 03:45:01,1
Masonic Emblems on Coins and Medallions during the French Revolution: https://www.conspiracyarchive.com/2015/08/11/masonic-emblems-on-coins-and-medallions-during-the-french-revolution/,15573,2024-12-18 13:15:02,1
Roots of the Hermetic Order of the Golden Dawn: https://www.conspiracyarchive.com/2015/07/28/roots-of-the-hermetic-order-of-the-golden-dawn/,15574,2024-09-10 10:15:01,1
10 Notable Members of the Bavarian Illuminati: https://www.conspiracyarchive.com/2015/09/20/10-notable-members-of-the-bavarian-illuminati/,15575,2024-08-14 13:15:01,1
What's the Origin of the Skull and Bones Painting in the Tomb at Yale? https://www.conspiracyarchive.com/2013/12/20/whats-the-origin-of-the-skull-and-bones-painting-in-the-tomb-at-yale/,15576,2024-07-23 01:15:01,1
"Francis Bacon was the father of inductive reasoning, the bedrock of the scientific method, a Freemason, Rosicrucian, Spear-Shaker, and believed by some to be the real William Shakespeare.",15579,2024-09-20 04:15:02,1
Fluoride has no beneficial biological role in the human body and is fundamentally a poison.,15580,2024-09-26 23:15:01,1
"Screw all you appeal-to-authority muppets who actually think it's ""anti-science"" to question doctors.",15581,2024-09-06 14:45:01,1
One of the original members of MJ-12 was put in control of the CIA when it was created in 1947.,15582,2024-11-08 20:45:01,1
The elites have subterranean bunkers all over.,15583,2024-08-09 08:15:02,1
"The Thule Society was the primary German Illuminati group prior to WWII. They recruited German leaders like Hitler who they placed in charge of their Nazi party. Saturn was an important god to them, so their lodges met on Saturday.",15584,2024-10-08 02:45:01,1
Nikola Tesla was without question a genius. He spoke eight languages. He could memorize entire books and recite them at will.,15585,2024-10-08 10:15:01,1
"The Smith-Mundt Act was repealed in 2013, which was put in place decades ago, now authorizing our own government (for the first time in history) to legally use propaganda against the public via the mainstream news media.",15586,2024-11-14 20:45:01,1
Nobody seems to notice. Nobody seems to care.,15587,2024-11-21 21:45:01,1
People forgot how to grow food.,15588,2024-08-16 06:45:01,1
"322 is the number of the Yale occult fraternity, Skull and Bones, whose members consist of top politicians and businessmen.",15589,2024-10-19 04:45:01,1
"It is no coincidence that Jay-Z's Roc-A-Fella record label is named after an Illuminati bloodline, the Rockefeller family.",15590,2024-11-11 06:45:01,1
"The human mind is easily manipulated through subliminal advertising, reverse speech, and suggestive imagery.",15591,2024-08-07 14:15:01,1
"The ruling authority of a Masonic jurisdiction is called a Grand Lodge, or sometimes a Grand Orient. These normally correspond to a single country, although their territory can be broader or narrower than that. In North America, each state and province has its own Grand Lodge.",15593,2024-12-08 11:15:01,1
"The question remains, why is the government protecting water fluoridation at all costs?",15594,2024-12-26 23:15:02,1
We've known for years that sodium nitrite consumption leads to leukemia in children and brain tumors in infants.,15595,2024-07-27 13:45:01,1
"If sodium nitrite is so dangerous, why do food producers continue using it? The chemical is added primarily as a color fixer that turns meats a reddish, fresh-looking color that appeals to consumers. Packaged meats like hot dogs would normally appear a putrid gray.",15596,2024-11-21 11:45:02,1
"The reason processed meats are so strongly correlated with cancer is, I believe, the continued use of a cancer-promoting additive called sodium nitrite.",15597,2024-06-29 11:15:01,1
"If there is one group of foods I can urge to avoid at all costs it would be bacon, salami and other processed meats. They're laced with dangerous preservatives called sodium nitrate & nitrate. These compounds transform into cancer-causing agents called nirosamines in the stomach.",15599,2024-05-31 17:45:01,1
"The mind, once stretched by a new idea, never returns to its original dimensions.",15600,2024-09-10 11:45:01,1
"Hans Kammler was in charge of the nazi bell program, and he disappeared after the end of the war but not before he told other nazi members that he had struck a deal with the American government for immunity.",15601,2024-07-03 18:15:01,1
"The Nazi Bell is associated with German UFO theories. It describes supposedly successful attempts to develop advanced aircraft or spacecraft prior to and during World War II, and further assert the post-war survival of these craft in secret underground bases in Antarctica.",15602,2024-12-10 18:45:01,1
There Are People Who Think the West Invaded Iraq Over a Stargate: https://www.vice.com/en_uk/article/533gxx/there-are-people-who-think-the-west-invaded-iraq-over-a-stargate,15603,2024-12-18 23:45:02,1
I wonder how many cures for diseases the government has all locked up.,15605,2024-11-21 18:15:01,1
"Few people realize just how saturated the United Nations and the European Union are with Satanism. The United Nations has all of their materials printed by The Lucis Trust, originally founded in 1922 as The Lucifer Trust.",15606,2024-11-13 22:45:02,1
"Apple, Google, Microsoft, Samsung, CISCO, and Silicon Valley are all part of the CIA's massive, and globalized covert apparatus.",15608,2024-12-07 13:45:01,1
"The public is not well-armed against the psychological warfare of the Elite, and is often easily led astray by their time-proven tactics.",15609,2024-10-07 02:15:01,1
People may not be aware that the Nazis were actually setting up a secret space program from the uppermost northern areas of Earth.,15610,2024-09-08 21:45:01,1
"In our society, there is a class of elitists who are directly involved with satanic pedophile rings.",15611,2024-12-23 15:45:01,1
Vatican Sitting On Time Machine? https://www.bibliotecapleyades.net/ciencia/time_travel/esp_ciencia_timetravel20.htm,15613,2024-12-07 10:15:01,1
"Belonging to the Vatican, the Chronovisor time machine is heralded as one of the papacy's best-kept secrets.",15615,2024-11-02 17:15:01,1
Way to disassociate from the system: Avoid fast food restaurants and chain restaurants.,15616,2024-12-27 11:15:01,1
"The CIA's successful development of remote viewing in the 1970s, where one can spy on anyone remotely through their consciousness, shows that the mind is not limited to our brain or our bodies.",15618,2024-12-11 16:15:01,1
The Secret US Military Device for Seeing in the Past: https://exonews.org/the-secret-us-military-device-for-seeing-in-the-past/,15619,2024-10-15 22:15:01,1
The Chronovisor - The Vatican's Secret Time-Seeing Device: https://www.ufoinsight.com/conspiracy/historical/chronovisor-vaticans-time-seeing-device,15620,2024-09-21 06:45:01,1
"Among the many alleged secrets the Vatican has, there is a device called the Chronovisor. The device enables its user to observe past events. Many believe this device is one of the greatest guarded secrets humanity has ever had.",15621,2024-12-27 10:45:01,1
"Josef Mengele, head Nazi mind-controller, was brought to the United States after World War II and lived undercover, directing U.S. mind-control operations, such as Project MK-ULTRA.",15623,2024-12-05 02:15:02,1
"Whether it is aspartame, sucralose (Splenda), or saccharin (Equal, Sweet N Low), artificial sweeteners have been poisoning brains for decades.",15624,2024-09-18 18:45:01,1
Project Looking Glass: https://www.bibliotecapleyades.net/ciencia/time_travel/project_lookingglass.htm,15625,2024-11-24 00:15:01,1
People don't know about Project Looking Glass.,15626,2024-12-11 23:15:01,1
The average person doesn't know what Project Looking Glass is.,15627,2024-11-30 11:15:01,1
"Beverly Eckert wouldn't ""take the money"" and was silenced. Research it.",15628,2024-12-11 20:15:01,1
"If you don't want to eat poison, grow your own food.",15629,2024-12-11 11:15:01,1
Many of Nikola Tesla's most important inventions have NEVER been released to the public and never will be.,15630,2024-12-01 12:15:01,1
Lee H. Oswald was a CIA asset who was used to foster the silly one-gunman theory of the JFK assassination. Any well-laid assassination will have a fall-guy to draw the attention of the public away from the real culprits.,15631,2024-12-05 02:45:01,1
The New World Order is an expression that's been used by Freemasonry since the days of Weishaupt to signify the coming one world government.,15632,2024-08-17 02:15:01,1
"Tesla said of the elite - ""If your hate could be turned into electricity, it would light up the whole world"". ",15633,2024-10-05 03:45:01,1
"Fluoride, which is prevalent in foods, beverages and water, is extremely damaging to the pineal gland (also known as the third eye).",15634,2024-12-04 21:15:01,1
"The Nazis were extremely interested in the Inner Earth and myths associated with it. It's believed that Antarctica is the entrance to the lost Aryan homeland of Thule. Even though Antarctica has been linked to the lost continent of Atlantis, the linkage to Thule is less apparent.",15635,2024-12-20 02:45:02,1
Ancient Flying Machine found in Cave? World leaders rush to Afganistan: https://internationalresearchsociety.wordpress.com/2012/08/14/ancient-flying-machine-found-in-cave-world-leaders-rush-to-afganistan/,15640,2024-09-26 06:15:01,1
It is time for the public to break free from the flood of propaganda and lies that the Mainstream Media utilizes in its effort to control us.,15641,2024-11-10 05:45:01,1
"The DoD can modify the weather. They plan to use this in warfare, ""to enhance friendly force capabilities & degrade those of the adversary.""",15643,2024-08-18 17:45:01,1
23 Mind Control US Patents 1956- 2003: https://www.youtube.com/watch?v=DiTvB8csqbA,15644,2024-09-21 21:15:01,1
"Some Nazi maps supposedly showed directions to reach an underground land presumed to be Agartha. This was stated in a letter from a German U-boat navigator, Karl Unger who also claims that a U-boat, U-209, made it to Agartha and confirmed that there is a kingdom within the earth.",15646,2024-07-14 18:45:01,1
"Our schools teach curriculums created by the Ford Foundation, Carnegie Endowment, the Rockefeller Foundation, and the Guggenheim Foundation.",15647,2024-09-24 18:45:01,1
What has happened to our food industry that we have to ask for the organic version of everything?,15648,2024-10-06 00:15:01,1
Look up Project Blue Beam.,15649,2024-06-09 13:45:01,1
Way to disassociate from the system: Use natural remedies instead of pharmaceuticals whenever possible.,15650,2024-11-11 00:45:01,1
"While processed meat is pumped full of many unhealthy and downright dangerous ingredients, sodium nitrite stands out as one of the worst. This is because it can be converted into a compound that is associated with cancer, Alzheimer's disease and even diabetes.",15651,2024-08-11 15:15:01,1
Pop Quiz: Who rammed Aspartame through the FDA by ignoring the concerns of 3 FDA scientists? You should know this.,15652,2024-06-08 23:45:01,1
"""The problem isn't that Johnny can't read. The problem isn't even that Johnny can't think. The problem is that Johnny doesn't know what thinking is; he confuses it with feeling."" ~ Thomas Sowell",15653,2024-08-14 19:45:01,1
"""It is the first responsibility of every citizen to question authority."" ~ Benjamin Franklin",15654,2024-06-10 15:45:01,1
"Remember that Bill Clinton flew on the ""Lolita Express"" to ""Orgy Island"" with a convicted pedophile.",15655,2024-09-08 09:15:01,1
The Most Expensive Hotel Room in the World Was Made For Elite Psychopaths: https://vigilantcitizen.com/sinistersites/the-most-expensive-hotel-room-in-the-world-was-made-for-elite-psychopaths/,15656,2024-11-30 14:45:01,1
Denver Airport Conspiracy. You didn't hear it from me. Look it up.,15657,2024-12-24 17:15:02,1
"The Pharmaceutical industry DOES NOT create cures, they create customers.",15658,2024-11-01 21:45:01,1
We need to drastically audit the hell out of the pentagon.,15659,2024-11-21 19:15:01,1
Look up Operation Mockingbird,15660,2024-09-10 09:15:01,1
Al-Qaeda is a documented CIA asset created in collaboration with Pakistan's ISI.,15661,2024-12-24 09:15:01,1
"I prefer ""critical thinker"" over conspiracy theorist.",15662,2024-11-01 14:15:01,1
They like to telegraph their punches because most are too ignorant and dumb to see it and they laugh all the way to the bank with your money that has their symbols mockingly engrained on it.,15663,2024-11-22 04:15:02,1
"If we're dealing with the law of averages, half of the events affecting our nation should be good. If we're dealing with incompetence, our leaders should occasionally make a mistake in our favor. We are not dealing with coincidence or stupidity, but with planning and brilliance.",15664,2024-11-29 13:15:01,1
The CIA's Operation Midnight Climax Was Exactly What It Sounded Like: https://medium.com/war-is-boring/the-cias-operation-midnight-climax-was-exactly-what-it-sounded-like-fa63f84ad015,15665,2024-11-26 15:45:01,1
"Is it just me, or did ""Fact Checkers"" not even exist, until the ugly truth started coming out?",15666,2024-12-24 23:45:02,1
"You can worry about Russia, China, North Korea, Iran, and whomever else if you want to, but the real enemy has been inside our gates for more than a hundred years already.",15667,2024-09-11 00:45:01,1
"How can you call your Mcnuggets ""chicken"" when they're 56% corn and contain over 35 ingredients aside from chicken?",15668,2024-11-04 03:45:01,1
"The planning and sophistication of deep underground government bases is almost unfathomable, but they exist.",15669,2024-10-31 02:15:01,1
Weather modification projects are not just happening in the United States. The truth is that they are going on all over the globe.,15670,2024-11-26 11:15:02,1
Bill Clinton jumped on Epstein's Lolita Express plane 26 TIMES: http://www.dailymail.co.uk/news/article-3589628/Report-Bill-Clinton-jumped-aboard-disgraced-sex-offender-Jeffrey-Epstein-s-Lolita-Express-plane-junkets-26-TIMES-just-three-years.html,15671,2024-10-20 19:15:01,1
"The cancer industry wants MORE cancer, which is exactly why it opposes commonsense prevention strategies that would reduce cancers.",15672,2024-11-21 14:45:02,1
"McDonalds chicken nuggets contain silicone oil, which is a synthetic material used to make contact lenses, caulking, and lubricants.",15673,2024-06-20 13:15:01,1
"Tell me, does one prefer aspartame laced soda or fluoride laced water?",15674,2024-07-21 14:15:01,1
"According to reporter Christopher Bollyn, Zim American Israeli Shipping CO broke a lease in order to vacate the World Trade Center just days before the 9/11 attack. Bollyn's source claims that Zim's lease extended through the end of the year and that the termination cost $50,000.",15675,2024-10-19 12:45:01,1
"Secret societies of dark knowledge exist to this day, having passed through centuries largely undetected, yet accumulating power.",15676,2024-10-08 06:15:01,1
"The CIA entered the mind-control game in the 1950s with the creation of Project Bluebird, headed by former Naval intelligence officer Morse Allan.",15677,2024-11-01 06:15:01,1
"It is in the interest of the central bankers to destabilize society, foster immorality, internal division, and war in order to increase debt and distract and control the masses.",15678,2024-12-08 21:15:01,1
"According to McDonald's own website, Chicken McNuggets are also made with: ""hydrogenated soybean oil with TBHQ and; citric acid added to preserve freshness"" and ""Dimethylpolysiloxane added as an antifoaming agent."" At least two of these ingredients are artificially synthesized industrial chemicals.",15679,2024-12-14 14:15:01,1
"If you are a chicken nuggets lover then you are a regular consumer of dimethylpolysiloxane, also known as silicone oil.",15680,2024-07-30 15:15:01,1
"Remember that Bill Gates flew on the ""Lolita Express"" to ""Orgy Island"" with a convicted pedophile.",15681,2024-09-04 21:15:01,1
"Bill Clinton traveled on the jet of convicted pedophile billionaire Jeffrey Epstein to Epstein's notorious ""Orgy Island"".",15682,2024-09-02 03:15:01,1
"There are supposedly various ""stargates"" in the middle east that the elite are interested in. It's said this is why U.S. military personnel went immediately into the museum in Baghdad before securing any other part of the city.",15683,2024-11-09 07:15:01,1
"Iodine can flush out chemical toxins like fluoride, lead, mercury, and biological toxins.",15684,2024-11-21 04:15:02,1
Remember when global banking cartels screwing over the world was a conspiracy theory?,15685,2024-07-13 18:15:01,1
"The phrase ""conspiracy"" or ""conspiracy theory"" has single-handedly mind-controlled millions of people like no other word or phrase has.",15686,2024-09-22 06:45:01,1
Make Orwell Fiction Again,15688,2024-11-29 15:45:01,1
It has been theorized by many credible sources that there are Stargates buried in the sands of Iraq. Iraq marks the home of the ancient Sumerians who held strong beliefs relating to interdimensional travel and may indeed hold the key to human creation.,15692,2024-12-06 23:45:01,1
One theory suggests that the 9/11 attacks were orchestrated by the US Government for the purpose of acquiring the Sumerian Stargates. Baghdad is believed to be the prime realty location where these Stargates lie.,15693,2024-11-27 01:15:01,1
The Iraqi Stargate Conspiracy: https://www.ufoinsight.com/conspiracy/technology/iraqi-stargate-conspiracy,15698,2024-09-24 01:45:01,1
"Near Nasiriyah, Iraq is an ancient Sumerian stargate hidden within an ancient ziggurat, discovered in the 1920's. Some say Saddam Hussein moved it underneath his palace in Baghdad and the real reason for the Iraq War in 2003 was for the US to seize the stargate.",15699,2024-11-25 16:45:01,1
It is a documented fact that the United States entered the Vietnam War under false pretenses.,15700,2024-09-25 20:45:02,1
"During World War II, the Tavistock Institute worked with the Rockefeller Foundation on esoteric experiments involving mind-altering drugs.",15702,2024-11-22 02:45:02,1
"Project Monarch may have culminated from MK-SEARCH sub-projects, which was set up to create ""sleeper assassins"" (i.e. Manchurian Candidates).",15703,2024-09-23 14:45:01,1
"""Who controls the food supply controls the people; who controls the energy can control whole continents; who controls money can control the world."" ~ Henry Kissinger",15704,2024-09-23 20:45:01,1
"Problem, reaction, solution. The elite create the problem, wait for the public's reaction to it, then provide the solution which would otherwise never have been considered without the problem they created in the first place.",15705,2024-08-13 21:45:01,1
Alexander the Great is chronicled to having witnessed UFOs while crossing a river in 329 BC.,15708,2024-09-21 02:15:01,1
