tweet,id,last_tweeted,active
The deception runs deep.,12085,2024-09-11 07:15:01,1
Conspiracy Theory with Jesse Ventura - Wall Street: https://vimeo.com/51494143,12087,2024-11-01 06:45:01,1
Conspiracy Theory with Jesse Ventura - Wall Street: https://vimeo.com/122011902,12088,2024-09-20 09:15:01,1
Rothschild Family Wealth is Five Times that of World's Top 8 Billionaires Combined: http://www.wakingtimes.com/2017/01/20/rothschild-family-wealth-five-times-worlds-top-8-billionaires-combined/,12089,2024-12-04 18:45:01,1
No more pretending you don't know.,12090,2024-12-18 22:45:01,1
5 Shocking Conspiracy Theories that Turned Out to be True: https://www.youtube.com/watch?v=qsc9YpukSog,12092,2024-11-14 14:15:01,1
"Observe. Look between the cracks, through the smoke, and beyond the obvious. Truth shines through.",12093,2024-10-14 11:45:01,1
"These days with so much available information, remaining willfully ignorant is clearly a choice.",12094,2024-12-23 12:45:01,1
"Our school system is designed to dumb students down, to teach them to memorize and obey, instead of teaching them to think for themselves.",12095,2024-07-17 11:15:01,1
Reject that which seeks to divide us and enjoy your delicious red pill.,12096,2024-07-17 10:15:01,1
"You can lead a horse to knowledge, but you can't make him THINK.",12098,2024-11-24 18:45:02,1
Notorious banker J.P. Morgan was scheduled to be on Titanic's maiden voyage but mysteriously canceled at the last minute.,12099,2024-12-07 10:45:02,1
Do the research for you not for me.,12100,2024-11-19 13:45:01,1
Essentially the New World Order is the concentration of power into the hands of a vertically top down authoritarian structure.,12101,2024-06-29 19:45:01,1
"When the whole world is running towards a cliff, he who is running in the opposite direction appears to have lost his mind.",12103,2024-08-16 03:45:01,1
The Manhattan Project proves that the government is able to keep secrets from thousands of participating people via compartmentalization.,12104,2024-12-01 23:45:01,1
The Council on Foreign Relations is an invitation only group made up of about 4000 people that comprise the shadow government of America.,12107,2024-09-07 22:45:01,1
"The original stated purpose of the Trilateral Commission was to create a ""New International Economic Order.""",12108,2024-11-25 11:15:01,1
People don't know about Operation Mockingbird.,12109,2024-07-07 16:45:01,1
"Neat way to keep things hidden: Just call it a conspiracy theory and its an automatic ""oh those crazy nuts"".",12110,2024-10-08 16:45:02,1
Paranoia is having all the facts.,12112,2024-09-22 11:15:01,1
The bilderberg conference is one of the real power structures of the planet.,12113,2024-09-03 16:15:01,1
Learning  true information and knowing it well enough to apply that knowledge to your life is a long and tedious task that's 100% worth it.,12114,2024-11-23 23:15:01,1
"Truth can never bow to the limited understanding of man, the comprehension of man must expand to grasp it.",12118,2024-10-19 13:45:01,1
"The United Nations is the greatest fraud in history. Its purpose is to destroy the United States. - John E. Rankin, US Congressman 1923-1953",12119,2024-07-05 09:45:01,1
"The more you know, the crazier you look.",12121,2024-12-22 14:45:01,1
We should all filter our own water.,12122,2024-07-18 01:45:01,1
The Federal Reserve Act is one of the most significant and horrific turning points in the history of America.,12125,2024-07-29 14:15:01,1
Disney did quite a bit of propaganda work for different government agencies in the past.,12126,2024-11-21 13:45:01,1
"You are being deceived, my friend.",12127,2024-10-18 04:15:01,1
Open your mind before you open your mouth.,12129,2024-12-04 16:15:01,1
Pay no attention to that man behind the curtain.,12132,2024-10-20 04:15:01,1
"""They wouldn't lie about that!"" - sheeple",12133,2024-09-26 02:45:01,1
"Remember, science is easily fudged if political pressure wants it to be.",12134,2024-09-05 10:45:01,1
Climate models that can accurately and consistently predict global temperatures in the not-so-distant future simply DO NOT EXIST.,12135,2024-06-28 15:45:02,1
"Haiku time:
Bomb jihad cocaine 
Keywords triggering watchers
I'm on a list now",12136,2024-07-09 10:45:01,1
"Controlled opposition gives us amazing nuggets of information, gets us to follow them like heroes, then spins us off into la la land.",12137,2024-09-08 08:15:01,1
"Tell me, does one prefer aspartame laced soda or fluoride laced water?",12138,2024-07-19 11:15:01,1
Food is the primary way we interact with our environment and it CAN alter genetic information in the space of a single generation.,12140,2024-12-11 18:15:01,1
"There has been surprisingly little research on how microwaves affect organic molecules, or how the human body responds to microwaved food.",12141,2024-12-07 06:45:01,1
There's far more money to be made in treating a disease than curing it.,12142,2024-08-03 17:15:01,1
protip: buy toothpaste without fluoride and deodorant without aluminum,12144,2024-11-21 10:45:02,1
"Humans are under the control of a strange force that bends them in absurd ways, forcing them to play a role in a bizarre game of deception.",12145,2024-10-06 02:45:01,1
The extent to which scientific principles are being bent to fit politically convenient conclusions is alarming.,12147,2024-08-10 05:45:01,1
Did you know that the Federal Reserve made 16 trillion dollars in secret loans to their friends during the last financial crisis?,12148,2024-12-23 13:45:02,1
Operation Midnight Climax. You didn't hear it from me. Look it up.,12150,2024-07-10 13:15:01,1
Learning  true information and knowing it well enough to apply that knowledge to your life is a long and tedious task that's 100% worth it.,14249,2024-11-06 22:45:01,1
"Truth can never bow to the limited understanding of man, the comprehension of man must expand to grasp it.",14253,2024-07-24 07:15:01,1
"Leaders of all major industrial countries like the US, England, Germany, Italy, Australia, etc. are active participants in the NWO.",14255,2024-07-06 10:15:02,1
"The more you know, the crazier you look.",14256,2024-10-07 23:45:01,1
"Know what they always find in Alzheimer's patients?
Excessive aluminum in the brain.

Know what makes your body hoard aluminum?
Fluoride.",14258,2024-11-08 03:45:01,1
No more pretending you don't know. It's time for you to rise into your calling and remember who you really are.,14259,2024-11-22 03:45:01,1
"You are being deceived, my friend.",14262,2024-12-22 23:45:01,1
"We are all emotional beings. They know it, so they manipulate, feed & prey on our emotions.",14263,2024-10-18 06:15:01,1
"The greatest prison people live in, is the fear of what other people think.",14265,2024-12-16 18:45:01,1
stop paying attention to their distractions,14266,2024-11-19 16:45:01,1
Pay no attention to that man behind the curtain.,14267,2024-07-08 12:15:01,1
"Rigged #Gov
Rigged #Media
Rigged #Politics
Rigged #Economy
Rigged #Currency
Rigged #Education",14286,2024-08-13 04:45:01,1
Corporate Media Just Exposed CIA Using Prostitutes to Drug Victims with LSD for Mind Control Studies: http://thefreethoughtproject.com/cia-mind-control-midnight-climax/,14288,2024-11-15 13:15:01,1
MK-ULTRA Victim Cathy O Brien: https://www.youtube.com/watch?v=Laon3_ob54A,14289,2024-12-11 22:45:01,1
Uncovering truths will often make you feel uncomfortable.,14290,2024-09-04 23:45:01,1
"To all the #truthseekers that are willing to speak out despite the consequences. Thank you, I love you all!",14292,2024-05-29 20:45:01,1
"Demons are organized in hierarchies and function as if they're in a military organization, according to Grimoires and Inquisition writings.",14293,2024-10-30 13:15:01,1
The average person doesn't know what Operation Mockingbird is.,14294,2024-08-18 03:15:01,1
"We are not here to accumulate money or physical possessions, we are here to help one another, love one another and grow.",14295,2024-11-30 07:15:01,1
"Targeted Individuals (TIs) are people who are illegally harassed, tortured, mind controlled, stalked and spied upon 24/7 by the government.",14296,2024-11-11 03:45:01,1
"US presidential candidates are picked at elite Bilderberg meetings, long before any public elections take place.",14297,2024-12-19 23:45:01,1
"Don't trust your government, don't trust corporations, don't trust the mainstream media, and don't trust the Federal Reserve! #EndTheFed #NWO",14298,2024-09-18 22:45:01,1
"If you ever caught yourself watching TV with your mouth open looking like a zombie, you were in alpha brain wave induced hypnosis.",14299,2024-11-10 12:45:01,1
"The greatest enemy of knowledge is not ignorance, it is the illusion of knowledge.",14300,2024-09-16 06:15:01,1
"I don't like being the bearer of bad news but if the bad news is the truth, then so be it.",14301,2024-11-23 03:15:01,1
"Why are over 7 billion people allowing 13 families to control every aspect of our lives, our souls and our planet?",14302,2024-11-14 07:45:01,1
"Biometrics, like facial and voice recognition, and implanted microchips are all New World Order population control mechanisms.",14303,2024-10-18 15:15:01,1
"Why are over 7 billion people allowing 13 families to control every aspect of our lives, our souls and our planet?",14304,2024-09-21 23:15:02,1
Remember MKUltra?,14305,2024-06-09 15:45:01,1
I can't emphasize enough how rare and subversive true wisdom is.,14306,2024-08-05 21:15:01,1
They literally spent more money investigating Bill Clinton's blowjob than investigating 9-11.,14308,2024-07-20 06:45:01,1
End MKULTRA mind control.,14309,2024-10-30 15:15:01,1
All Wars Are Banker Wars: https://www.youtube.com/watch?&v=5hfEBupAeo4,14310,2024-08-14 22:45:01,1
"Project MK-ULTRA was the code name given to an illegal program of experiments on human subjects, designed and undertaken by the US CIA.",14311,2024-12-04 10:45:01,1
Our schools are corrupt. Our govt. is corrupt. Our police are corrupt. The FDA is corrupt. Our courts are corrupt. Our churches are corrupt.,14312,2024-08-14 18:45:01,1
"Facial recognition systems will go nation wide in a few years identifying everyone, everywhere.",14313,2024-10-22 07:45:01,1
Tell the WhiteHouse to splinter the CIA into a thousand pieces and scatter it to the far winds.,14314,2024-11-13 23:15:02,1
"Behind all of our seemingly innocent cartoons, magazines, movies, TV shows, and music is a hidden agenda to control our children's minds.",14316,2024-07-16 19:45:01,1
"People have heard of Sigmund Freud, but few have heard of his nephew Edward Bernays. Edward Bernays helped shape the way you see the world.",14317,2024-11-27 05:45:01,1
Celebrity culture is systematically used to condition the masses using various social engineering and mind control techniques.,14318,2024-07-15 10:45:01,1
Snopes is definitely a disinfo website. Snopes receives funding from an undisclosed source. Snopes refuses to disclose that source.,14319,2024-11-20 17:45:01,1
Angels Still Don't Play This HAARP - FULL LENGTH: https://www.youtube.com/watch?v=bOVRXM3NMTo,14320,2024-07-14 17:15:01,1
"If you really knew how much behind the scenes stuff goes on that we never hear about, it would amaze you.",14321,2024-12-08 00:15:01,1
Censorship is the tool of those who have the need to hide actualities from themselves and from others.,14322,2024-11-23 12:15:01,1
"Only a brave person is willing to honestly admit, and fearlessly to face, what a sincere and logical mind discovers.",14323,2024-08-07 19:45:01,1
This DEBT based money system is DESIGNED to fail.,14324,2024-07-31 01:15:02,1
"Great minds discuss ideas, average minds discuss events, small minds discuss people. #WakeUp",14325,2024-08-05 13:45:01,1
"If you think ""It can't happen in America""... it has already happened, they just haven't told us yet.",14327,2024-12-04 03:15:01,1
The fate of a brighter future rests in your hands. Yes you reading this.,14328,2024-11-01 18:15:02,1
Conspiracy Theorist: Nothing more than a derogatory title used to dismiss a critical thinker.,14329,2024-07-10 01:15:01,1
Researchers say that watching too much TV is as dangerous as smoking or being overweight.,14330,2024-09-19 07:45:01,1
The Federal Reserve's trillion dollar printing presses will eventually plunder the world economy. It must be abolished.,14331,2024-07-09 16:15:01,1
An unelected group of bankers can create money out of thin air and give it out to megabanks and supercorporations like Halloween candy.,14332,2024-07-05 01:15:01,1
"Have you realized yet that the Federal Reserve is an entity onto itself, which has no oversight and no accountability? It must be abolished.",14333,2024-08-16 23:15:02,1
The American public should be outraged to know that the Federal Reserve bailed out foreign banks while they were struggling to find jobs.,14334,2024-08-10 18:45:01,1
"The Federal Reserve has secretly bailed out many of the world's banks, corporations, and governments.",14336,2024-09-09 23:45:01,1
"Independent scientists say that a HAARP-type ""skybuster"" with its unforeseen effects could be an act of global vandalism.",14337,2024-10-14 15:45:01,1
Bill Clinton ditched Secret Service on multiple Lolita Express flights: http://www.washingtontimes.com/news/2016/may/14/bill-clinton-ditched-secret-service-on-multiple-lo/,14338,2024-11-25 07:45:01,1
"Montauk victims were controlled by ""dreams"" and the whole project was based on electronically controlling the astral field & orgone energy.",14339,2024-11-13 19:45:01,1
A form of torture used in MKULTRA is to place victims in a drug-induced stupor while recorded messages are continuously played to them 24/7.,14340,2024-11-14 23:15:02,1
Disneyland is one of the most common locations for MKULTRA-related Mind-Controlled programming according to whistleblowers.,14341,2024-05-15 03:15:01,1
Don't say some of us didn't warn you. We tried.,14343,2024-11-14 01:15:01,1
"The CFR is more than a ""think tank"", it is a network of elitists that control America by creating policies, laws and monopolies.",14345,2024-12-07 06:15:01,1
Things do not happen. Things are made to happen,14346,2024-06-28 04:45:01,1
College tuition has increased up to 3 times the rate of inflation since 1978.,14347,2024-10-31 15:15:01,1
"There are mkultra mind control assets worldwide, ready to shill against any person who establishes a true opposition.",14350,2024-10-05 19:15:01,1
"Truman: ""CIA dont just report on wars.. they go out and make their own. It's become a government all of its own and all secret""",14351,2024-09-09 17:15:01,1
It takes courage to even look at information to see what is going on. Some are afraid to see how ugly the truth is. Let alone act on it.,14353,2024-11-02 20:45:01,1
"If you're not careful the media will have you hating the people who are being oppressed, and loving the people who are doing the oppressing.",14354,2024-11-10 11:45:01,1
"Diamonds aren't actually that rare, De Beers creates an artificial scarcity by stockpiling mined diamonds and selling them in small amounts.",14355,2024-12-07 01:45:01,1
Silent Weapons For Quiet Wars Document - Full Read: https://www.youtube.com/watch?v=g891HMa_45o,14356,2024-11-15 15:45:02,1
"Instead of raising our children ourselves, we allow the government schools and the entertainment industry to do it.",14357,2024-11-14 10:45:01,1
"We see a society that not only has a lot more people of lower IQ, but a lot fewer people of higher IQ. A chemical dumbing down of society.",14358,2024-08-18 18:45:01,1
Agenda 21 For Dummies: http://www.youtube.com/watch?v=TzEEgtOFFlM,14359,2024-11-25 08:15:01,1
Think for yourself. Question authority.,14360,2024-07-19 14:15:01,1
Just because you are paranoid does not mean they are not out to get you.,14361,2024-07-17 21:15:01,1
Those who have the privilege to know have the duty to act.,14362,2024-06-05 08:15:01,1
I don't believe in coincidence theories.,14363,2024-12-28 11:15:02,1
"The rich have been robbing from the poor since the days of the first king, the first priest, the first banker, the first tax collector.",14364,2024-12-25 10:45:02,1
A society grows great when old men plant trees whose shade they know they shall never sit in.,14365,2024-11-29 11:15:01,1
Sometimes people don't want to hear the truth because they don't want their illusion broken.,14366,2024-07-20 18:45:01,1
The upper class sees the people as a permanent underclass that must be controlled by any means necessary.,14367,2024-08-11 22:45:01,1
The Rockefeller Institute convinced the world to use A = 440 standard tuning. A = 432hz ( and C = 256hz ) was what orchestras used to use.,14368,2024-06-11 16:15:01,1
Whoever controls the flow of information controls the minds of the global population.,14369,2024-09-26 12:15:01,1
Much of the mind control programming that is used in the Mainstream Media occurs subliminally and takes place completely under the radar.,14370,2024-08-11 06:15:01,1
"Watch less TV, live more.",14371,2024-09-04 15:15:01,1
Nothing is random. You're here on this planet at this particular time for a reason. Now make a difference.,14372,2024-11-23 07:45:02,1
People don't know about Silent Weapons For Quiet Wars.,14373,2024-09-03 08:45:01,1
The Great Global Warming Swindle - Full Documentary: https://www.youtube.com/watch?v=oYhCQv5tNsQ,14374,2024-12-20 04:45:01,1
End Game: http://www.youtube.com/watch?v=x-CrNlilZho,14375,2024-10-05 07:15:01,1
"Project mkultra
Project Bluebird
Project Artichoke
Project mksearch
Operation Paperclip
Project 63
#CIA ",14376,2024-11-11 01:45:01,1
The real rulers in Washington are invisible and exercise their power from behind the scenes.,14377,2024-11-30 15:15:02,1
"Victims of mind control programming are often hunted like wild animals, tortured and raped for the amusement of CIA, military and politicians.",14378,2024-11-13 14:45:01,1
Silent Weapons for Quiet Wars: http://www.youtube.com/watch?v=g891HMa_45o,14379,2024-09-08 00:15:01,1
A 2009 INTERPOL operation rescued 54 children from child slave plantations that were directly profiting the Nestle corporation.,14380,2024-10-22 07:15:01,1
Things don't happen. Things are made to happen,14381,2024-12-25 13:45:02,1
Conspiracies are strategies with less disclosure and clearance.,14382,2024-12-28 07:15:01,1
The political parties are a lot like professional wrestlers: they duke it out on stage but they're all being paid by the same corporations.,14383,2024-07-21 16:15:01,1
Clearly the Council on Foreign Relations has an extreme amount of power within the United States and throughout the world.,14384,2024-08-08 16:45:01,1
Modern art was CIA weapon: http://www.independent.co.uk/news/world/modern-art-was-cia-weapon-1578808.html,14386,2024-06-11 14:15:01,1
The mainstream corporate media is desperate. They want to suppress independent and alternative online media which it categorizes as fake news.,14387,2024-07-25 22:15:01,1
"Even the Federal Reserve itself has argued that it is ""not an agency"" of the federal government in court.",14388,2024-09-24 00:15:01,1
Wake Up Call - Remastered Edition: https://www.youtube.com/watch?v=BMOPZzz2_DY,14389,2024-09-22 11:45:02,1
Wake Up Call - New World Order Documentary: https://www.youtube.com/watch?v=BMOPZzz2_DY,14390,2024-07-15 09:45:01,1
Wake Up Call - Remastered Edition - Full Movie: https://www.youtube.com/watch?v=BMOPZzz2_DY,14391,2024-07-20 12:15:01,1
Wake Up Call - New World Order (#Documentary): https://www.youtube.com/watch?v=BMOPZzz2_DY,14392,2024-10-16 09:45:01,1
Wake Up Call - New World Order (#Documentary): https://www.youtube.com/watch?v=BMOPZzz2_DY,14393,2024-12-11 21:15:01,1
The Rockefeller plan has included funding the UN headquarters and founding the Bilderberg conference of the global super elite.,14394,2024-10-31 12:45:01,1
Bilderberg is one of the real power structures of the planet & must be exposed to ever have a chance to dethrone the global crime syndicate.,14395,2024-11-26 17:15:01,1
I'm trying to free your mind. But I can only show you the door. You're the one that has to walk through it.,14396,2024-10-21 21:15:01,1
The rabbit hole just keeps getting deeper.,14397,2024-09-19 00:15:01,1
"They must find it difficult, those who have taken authority as the truth, rather than truth as the authority.",14398,2024-09-07 05:45:01,1
What is Mk Ultra? https://www.youtube.com/watch?v=rnwzIr8nY4E,14399,2024-10-19 15:45:02,1
"Propaganda Outlets: CNN, MSNBC, ABC, BBC, CBS & Fox News.",14400,2024-12-07 21:45:01,1
"If you really want to know what is happening in the world, you must first turn off the TV.",14401,2024-09-11 09:45:01,1
The whole notion of a conspiracy has been so ridiculed that it's socially challenging just to consider it.,14402,2024-09-09 19:15:01,1
Join the movement to audit and end the private Federal Reserve. #EndTheFed,14403,2024-09-23 04:15:02,1
I awoke only to see that the rest of the world is still asleep.,14404,2024-09-23 21:45:01,1
Think. It's not illegal yet.,14405,2024-10-05 13:15:01,1
"Once you are Awake, Signs are Everywhere",14406,2024-11-15 00:45:01,1
And I will strike down upon thee with great vengeance and furious anger those who attempt to poison and destroy my brothers.,14407,2024-09-26 05:15:01,1
Celebrity gossip is used to personalize the relationships between citizens and puppets (celebrities).,14408,2024-12-22 13:15:01,1
"ALWAYS assume that you are under surveillance. At this point, if you are NOT under surveillance, you are not a very good activist!",14409,2024-08-12 21:45:01,1
"End all wars, murder, destruction, plunder and waste, and put an end to the slumber they want you to stay forever in.",14411,2024-11-19 14:15:01,1
"Our top government leaders have a history of lying, and exploiting American citizens for their own selfish agendas and financial profits.",14412,2024-12-01 05:45:01,1
Over-medicated and under-educated is exactly how they want us.,14413,2024-10-20 23:45:01,1
"Agenda 21 is a plan to collectivize private property, reeducate the world into a single globalist mindset and eventually depopulate the world.",14414,2024-06-24 13:45:01,1
"All humans are susceptible to the ""Illusion of Truth"" effect - The more we hear something, the more we believe it's true.",14415,2024-10-21 16:15:01,1
John Perkins - The Secret History of the American Empire: https://www.youtube.com/watch?v=7fVAifnnlg0,14418,2024-06-28 09:45:01,1
Most of the world's capital is owned by about 2% of the world's people.,14420,2024-11-23 20:15:02,1
Government officials dislike those who expose their illegal surveillance and trigger global debate about their behavior.,14422,2024-11-01 22:15:01,1
The Rockefeller Institute convinced the world to use A = 440 standard tuning. It was chosen for it's unsettling quality.,14424,2024-11-10 18:15:01,1
The truth is out there. Don't allow all of the useless distractions of this world keep you from searching for it.,14425,2024-08-17 16:15:01,1
"Have we realized the ""Federal"" Reserve is a *private* bank yet? Secretive and unaccountable.",14426,2024-10-17 10:45:01,1
"Our government controls the weather and controls the news, yet we still get wrong weather forecasts. #AmericanProblems",14427,2024-08-24 06:45:01,1
"They want to ""free"" us from our wallet and keys by implanting microchips into us? - NO THANKS. You will not enslave me.",14429,2024-06-27 15:45:01,1
End World Ignorance.,14430,2024-09-07 08:45:01,1
One of the best ways to fight against the New World Order is to become more self-sufficient.,14431,2024-11-20 18:45:01,1
Kill your T.V.,14432,2024-06-26 13:15:01,1
"On September 11th, 1973, the CIA supported the assassination of Salvador Allende, the democratically elected leader of Chile.",14433,2024-11-26 23:45:01,1
A real protest doesn't ask for permission!,14434,2024-11-26 15:15:01,1
"Just because it's history doesn't mean it's accurate history. The winner writes history, remember that.",14435,2024-11-22 21:45:01,1
"Your mind is your greatest weapon, your thoughts are the highest form of resistance.",14436,2024-12-24 07:15:02,1
Do you see the value of what real journalists do? There aren't many of them around anymore. A dying breed because there's no money in it.,14437,2024-09-22 08:15:01,1
Knowledge is POWER. Educate yourself and then educate others. AWARENESS is the KEY to change!,14438,2024-10-05 10:15:01,1
"Whenever there is a big story in the media, look for the story they're trying to distract you from.",14439,2024-12-27 11:45:01,1
"Your homework today is to search: ""heart attack gun""",14440,2024-06-25 23:15:01,1
The Federal Reserve is no more federal than Federal Express. It is a private bank that runs the government.,14441,2024-09-18 17:45:01,1
"To every fed monitoring us - Just know we have a common enemy, the globalists stole your children's future and humanity's.",14442,2024-10-18 19:45:01,1
Wisdom is not a product of schooling but of the lifelong attempt to acquire it.,14443,2024-09-05 10:15:01,1
"Go do something illegal today, like feed the homeless.",14444,2024-07-30 18:15:01,1
Governments don't want a population capable of critical thinking!,14445,2024-09-10 00:15:01,1
Bankers like David Rockefeller and the European Rothschild families conspire for world domination.,14446,2024-10-16 02:45:01,1
AMERICANS ARE BEING DUMBED DOWN ON PURPOSE!,14447,2024-11-08 18:45:01,1
If you don't control your mind someone else will.,14448,2024-11-14 17:45:01,1
Truth is treason in the empire of lies.,14449,2024-06-08 22:15:01,1
"We're all being religiously, psychologically, politically, technologically, and militarily primed for global self-enslavement. #NWO",14451,2024-10-18 12:45:01,1
It is clear that the government of the United States no longer acts with the interest of its citizens.,14452,2024-06-05 20:45:01,1
"They have plans to put chips in all of us, and those who don't want it won't be able to buy and sell.",14453,2024-03-13 20:45:01,1
"If we can get enough people to wake up, perhaps there is still enough time to turn this world in a different direction.",14455,2024-12-10 02:45:01,1
