tweet,id,last_tweeted,active
"Please tell me why we were in Afghanistan again. It sure as hell wasn't to defeat the little CIA proxy, Al Qaeda, but to secure their Heroin.",16730,2024-08-09 15:45:01,1
"Alcohol, tobacco and firearms should be a Convenience store NOT a government agency.",16731,2024-07-09 08:45:01,1
Aluminum is put into roll on deodorants which we then roll on to our armpits which is where our lymph nodes are. Aluminum is also put into sunscreen. Our food and drinks are put into aluminum cans. Aluminum causes dementia and Alzheimer's.,16732,2024-10-18 00:15:01,1
Windows is spying on everything you do.,16733,2024-09-08 12:15:01,1
Let's get this straight: loyalty cards are tracking systems invented by retailers and held over consumers heads by ballooned prices.,16734,2024-11-24 17:45:01,1
"During the Middle Ages the peace symbol, of today, was known as the Crow's Foot or Witches Foot, the insignia of Satan.",16735,2024-11-26 08:15:01,1
"5G is the last actual hold up of the globalist plan. You cannot implement the type of social controls they want without it. Everyone will be chipped and part of the IOT. This will be how they exert their social credit control. Once it is fully rolled out, the floodgates will open",16736,2024-09-21 10:15:01,1
No one is talking about 6G.,16737,2024-12-23 21:45:01,1
"Many songs have hidden, reversed messages within them. This method of subliminal messaging is called back-masking.",16738,2024-10-31 14:45:01,1
"About my page:

There will be stuff you don't like. I'm going to tweet it anyway. ",16739,2024-11-11 19:45:02,1
The NSA backs up my data for me.,16740,2024-06-27 15:15:01,1
"Your government isn't failing, it's trying to kill you.

There's a difference.",16741,2024-10-17 21:15:01,1
"The economy is rigged, intended to financially enslave you for the rest of your life while it endlessly funnels the world's wealth to the very top of the pyramid.",16742,2024-12-09 11:45:01,1
One idiot is one idiot. Two idiots are two idiots. Ten thousand idiots are a political party,16743,2024-07-12 01:45:01,1
"You are in fact slaves, confined in ways you don't even comprehend.",16744,2024-09-22 23:45:01,1
Windows is spying on and tracking its users.,16746,2024-11-06 23:45:01,1
Evidence is surfacing that points toward the possibility of a highly technologically advanced ancient culture that predates all others.,16747,2024-12-24 00:45:01,1
"The US intelligence community funded, nurtured and incubated Google as part of a drive to dominate the world through control of information.",16748,2024-12-29 01:15:01,1
"Recession is inevitable - wipe out asset holdings of the middle class, transfer to the rich. Rinse & repeat.",16749,2024-11-02 00:45:01,1
People don't know about Blackrock's AI Aladdin that controls most of the worlds capital. Everything you do funds that beast.,16750,2024-12-25 04:45:01,1
"The Hellfire Club was involved in abductions, sexual assaults, murders, dismemberment, and cannibalism during their banquets.",16751,2024-09-19 12:15:01,1
Niels Harrit - The Seventh Tower: https://www.youtube.com/watch?v=PRnLmFgjPxs,16753,2024-08-16 09:15:01,1
Knowledge makes a man unfit to be a slave.,16754,2024-10-17 04:45:01,1
"""Knowledge makes a man unfit to be a slave."" ~ Frederick Douglass",16755,2024-06-11 19:45:01,1
"""Find out just what any people will quietly submit to and you have the exact measure of the injustice and wrong which will be imposed on them."" ~ Frederick Douglass",16756,2024-12-20 04:15:01,1
"""To suppress free speech is a double wrong. It violates the rights of the hearer as well as those of the speaker."" ~ Frederick Douglass",16757,2024-07-14 06:45:01,1
Politicians should be limited to two terms: 1 in office and 1 in prison.,16758,2024-12-19 05:45:01,1
"McDonald's long list of ingredients includes dimethylpolysiloxane, an anti-foaming agent to keep oil from splattering, and TBQH, aka tertiary butylhydroquinone, a anti-oxidant that helps preserve the freshness of the many oils used in the process.",16759,2024-10-19 08:45:01,1
"Broccoli, garlic, onions, and sprouts all have powerful anti-cancer effects, as do dozens of Chinese and Western herbs.",16760,2024-12-28 19:45:02,1
"The EPA is allowing staggering increases in pesticide use that will undoubtedly harm our nation's people, plants and animals.",16761,2024-11-09 03:45:01,1
"Bill Clinton visited Jeffrey Epstein's private island, unsealed court documents suggest: https://www.foxnews.com/us/bill-clinton-visited-jeffrey-epsteins-private-island-unsealed-court-documents-suggest",16762,2024-11-10 16:15:01,1
Guess why they want to have centralized killswitches in all vehicles...,16763,2024-06-24 23:15:01,1
"It's clear to me at this point, that a large portion of the population is in some kind of actual trance.",16765,2024-05-06 06:45:02,1
"As ridiculous as it sounds to most people, I'm convinced that we're witnessing some kind of actual occult ""black magic spell"" being used on a global scale. ",16766,2024-07-24 20:15:01,1
The people of Earth have had enough.,16767,2024-08-08 08:15:01,1
"Pesticides have been linked to brain and nervous system damage, cancer, disruption of the endocrine and immune system, and other toxic effects.",16768,2024-12-14 06:45:02,1
Bill Gates traveled to Epstein Island 37 times... that we know of.,16769,2024-09-27 00:45:01,1
Both Joseph Smith (who founded Mormonism) and L. Ron Hubbard (who founded Scientology) were 33rd degree Freemasons.,16770,2024-07-02 00:45:02,1
What more is it going to take for people to wake up and realise that the puppet governments and ruling elite don't care about us,16771,2024-10-07 00:15:01,1
Klaus Schwab is a bigger threat to your future than Vladimir Putin,16772,2024-12-23 03:45:01,1
The Occult Symbolism Found on the Bank of America Murals: https://vigilantcitizen.com/sinistersites/analysis-of-the-occult-symbols-found-on-the-bank-of-america-murals/,16773,2024-11-01 00:45:01,1
Did the Vatican hide an Egyptian papyrus that reveals flying 'fiery disks' described by a Pharaoh? https://mysteriesrunsolved.com/2021/06/egyptian-papyrus-of-fiery-disks.html,16774,2024-10-21 13:15:01,1
"We've centralized all of our data to a guy called Mark Zuckerberg, who's basically the biggest dictator in the world as he wasn't elected by anyone.",16776,2024-09-08 19:45:01,1
"They've compromised the genome of almost the entire planet and nobody seems to notice, nobody seems to care. ",16778,2024-07-21 08:45:01,1
Why are most people cowards?,16779,2024-06-21 18:15:01,1
The eyes are useless when the mind is blind. ,16780,2024-08-11 22:15:01,1
What a Coincidence that the chosen Leaders of the World Economic Forum keep winning Elections even though they are absolutely DESPISED by all of their Citizens?,16781,2024-07-31 15:15:01,1
They don't want to ban guns. They want a monopoly on them.,16782,2024-12-13 22:45:01,1
The Sirius concept is so crucial for Freemasons that it is embedded in some of the most important structures in the world.,16783,2024-08-15 16:45:01,1
Nothing is a coincidence. Pay attention to the signs. It's getting more obvious now!,16784,2024-09-06 23:15:01,1
"To avoid counting civilian deaths, Obama re-defined ""militant"" to mean ""all military-age males in a strike zone"".",16785,2024-12-02 00:45:01,1
"In 2009, Obama received the Nobel Peace Prize even as the U.S. increased military spending by 8% that year.",16786,2024-07-25 06:45:01,1
The Top 10 Creepiest and Most Dystopian Things Pushed by the World Economic Forum: https://vigilantcitizen.com/vigilantreport/top-10-insane-wef/,16787,2024-10-18 01:45:01,1
You are the carbon they want to reduce.,16788,2024-09-06 12:45:01,1
The difference between government and thieves is that thieves don't pretend they're helping you.,16789,2024-11-30 12:15:01,1
Don't let Ghislaine Maxwell's sentencing end this story. The list of client names must be dealt with properly.,16790,2024-11-24 09:15:01,1
People don't know about deep underground military bases.,16791,2024-11-11 07:15:01,1
10 Ways That Freud's Nephew Duped Us All (And Still Does): https://listverse.com/2019/09/26/edward-bernays-freud-tricked-us/,16792,2024-12-11 10:15:02,1
"How did we go from starting a revolution over a tax on tea to collectively shrugging our shoulders when the government locks us in our homes, keeps us from seeing our families and arbitrarily closes our small businesses?",16793,2024-11-02 19:15:01,1
"If you think eating organically and locally is expensive, you should see the price of cancer lately.",16794,2024-10-15 15:15:01,1
"A New Satellite Can Peer Inside Some Buildings, Day or Night: https://futurism.com/new-satellite-buildings-day-night",16795,2024-12-14 20:15:01,1
"Look into:

Operation mockingbird 
Project for a new American century
Operation northwoods
Operation gladio
Operation dark winter 
Operation Atlantic storm
Operation condor
Tuskegee syphilis 
Project monarch
Operation mkultra

I can do this all day.",16796,2024-12-27 10:15:02,1
Very few are aware that stock market crashes are perfectly controlled demolitions of the Global Economic and Financial Systems.,16797,2024-12-07 13:15:01,1
"The term ""conspiracy theorist"" was created by the CIA to stop the weak minded thinking too far outside of their box. They label anything they don't want people to believe as a 'conspiracy theory' and no one believes it. The fear of ridicule is a powerful antidote to free-thought.",16798,2024-08-15 13:45:01,1
"The company behind all those pink ribbons, the Susan G. Komen Foundation, uses less than a dime of each dollar to actually look for a cure.",16799,2024-12-23 10:15:01,1
Research into the use of microwave weapons and their applications for mind control began in the 1950s at the Tavistock Institute in England.,16801,2024-10-06 21:45:01,1
The history of the term 'conspiracy theory' was that it was promoted heavily by the CIA and FBI in the media to dismiss people as crazy who were linking intelligence agencies to the Kennedy assassination.,16802,2024-11-08 02:45:01,1
"The U.S. government has spent over $75 million to prosecute Barry Bonds for steroids. It only spent $12-$20 million ""investigating"" 9/11.",16803,2024-12-28 11:45:02,1
Over-medicated and under-educated is exactly how they want us.,16804,2024-08-19 05:45:02,1
7 Ways To Protect Yourself From The Ruling Elite's World Depopulation Agenda: https://www.activistpost.com/2017/03/7-ways-protect-ruling-elites-world-depopulation-agenda.html,16805,2024-08-03 02:15:02,1
"""Governments don't want a population capable of critical thinking. They want obedient workers."" ~ George Carlin",16806,2024-11-25 04:45:02,1
"""Think of how stupid the average person is, and realize half of them are stupider than that."" ~ George Carlin",16807,2024-08-09 02:45:01,1
Know Your Enemy - Skull & Bones Secret Society: https://www.youtube.com/watch?v=MrlRcWiHhI4,16808,2024-11-24 21:15:01,1
"Prescott Bush, and some of his buddies at Yale, dug up the grave of Apache chief Geronimo, removing his skull and femur and placing them in a glass case in the lobby of the Tomb, the headquarters of the university's notorious Skull and Bones society back in 1917.",16809,2024-09-21 20:45:02,1
Dark Secrets Inside Bohemian Grove: http://www.youtube.com/watch?v=FVtEvplXMLs,16811,2024-10-17 22:15:01,1
The global elite party at The Bohemian Grove during the second week of every July among homosexual orgies and Satanic rituals!,16812,2024-09-18 19:45:01,1
Bohemian Grove rituals include: Worshiping the pagan god Molech that looks like an owl and sacrificing effigies of babies to it.,16813,2024-12-10 05:45:01,1
Bohemian Grove rituals include: Worshiping the pagan god Molech that looks like an owl and sacrificing effigies of children to it.,16814,2024-12-28 06:45:01,1
"Bohemian Grove. The great owl. Check the back of the $1 bill. It's small, but you can find it.",16815,2024-10-17 11:15:01,1
"The fact is, more and more people want non-GMO food, and our local farms have a right to grow without contamination. It's that simple.",16816,2024-07-09 16:45:01,1
"I could tell you the really good stuff, but then twitter would ban me and the CIA would have to hunt you down.",16818,2024-08-06 09:45:01,1
"9-to-5 is a prison.

And the illusions of security are the walls holding you in.",16819,2024-08-13 22:45:01,1
become ungovernable,16820,2024-11-11 15:45:01,1
Rothschild Family Wealth is Five Times that of World's Top 8 Billionaires Combined: http://www.wakingtimes.com/2017/01/20/rothschild-family-wealth-five-times-worlds-top-8-billionaires-combined/,16821,2024-07-02 14:15:02,1
"""Whoever fights monsters should see to it that in the process he does not become a monster. And if you gaze long enough into an abyss, the abyss will gaze back into you."" ~ Friedrich Nietzsche",16827,2024-10-06 23:45:01,1
The Occult Symbolism of the Vatican's 2020 Nativity Scene: https://vigilantcitizen.com/sinistersites/the-occult-symbolism-of-the-vaticans-2020-nativity-scene/,16829,2024-10-08 10:45:01,1
Why Are There Paintings Depicting Ritual Abuse On Display at the Las Vegas Courthouse? https://vigilantcitizen.com/latestnews/paintings-depicting-ritual-abuse-display-las-vegas-courthouse/,16830,2024-07-27 11:45:01,1
"The Denver Airport Installs a Talking Gargoyle That Says ""Welcome to the Illuminati Headquarters"": https://vigilantcitizen.com/latestnews/the-denver-airport-installs-a-talking-gargoyle-that-says-welcome-to-the-illuminati-headquarters/",16831,2024-12-01 11:15:01,1
"Abundant liquid mercury, mica, and pyrite found in tunnels beneath the pyramids: https://www.ancient-code.com/abundant-liquid-mercury-mica-and-pyrite-found-in-tunnels-beneath-the-pyramids/",16834,2024-09-22 03:45:01,1
"The Denver International Airport will become much more than a regular commercial airport. It has the capacity to handle a huge amount of people and vehicles, leading observers to think that the structure might be used as a civilian concentration camp in the near future.",16836,2024-08-05 07:45:01,1
"There are so many irregularities surrounding the Denver International Airport. The facilities and art displayed lead many to believe that the DIA is more than an airport: it is literally a New-Age cathedral, full of occult symbolism and references to secret societies.",16837,2024-12-07 11:15:01,1
"There are so many irregularities surrounding the Denver International Airport, that a book could be written on it. 

An apocalyptic horse with glowing red eyes welcoming visitors? Check.

Nightmarish murals? Check.

Strange words and symbols embedded in the floor? Check.",16838,2024-10-17 20:15:01,1
The Elite Machine Behind Greta Thunberg: https://vigilantcitizen.com/vigilantreport/the-elite-machine-behind-greta-thunberg/,16839,2024-11-10 02:15:01,1
British Politician 'Murdered' Young Boy During Depraved Elite Party: https://vigilantcitizen.com/latestnews/abuse-victim-british-politician-murdered-young-boy-depraved-elite-party/,16840,2024-07-02 19:45:01,1
Ties Between Bill Gates and Jeffrey Epstein Cited as a Cause of Divorce With Melinda Gates: https://vigilantcitizen.com/latestnews/ties-between-bill-gates-and-jeffrey-epstein-cited-as-a-cause-of-divorce-with-melinda-gates/,16842,2024-10-05 10:45:02,1
The Presidential Advisor Who Introduced Epstein to Clinton Found Dead By Hanging With Gunshot Wound to Chest: https://vigilantcitizen.com/latestnews/the-extension-cord-code-the-mysterious-death-of-the-presidential-advisor-who-introduced-jeffrey-epstein-to-bill-clinton/,16843,2024-09-05 13:15:01,1
Microsoft Releases (and Deletes) an Ad With Elite Occultist Marina Abramovic: https://vigilantcitizen.com/latestnews/microsoft-releases-and-deletes-an-ad-with-elite-occultist-marina-abramovic/,16844,2024-12-04 09:15:01,1
British royalty dined on human flesh: https://www.dailymail.co.uk/news/article-1389142/British-royalty-dined-human-flesh-dont-worry-300-years-ago.html,16845,2024-09-19 02:15:01,1
Mozart's creations often incorporated important Masonic elements. The Magic Flute opera was mainly based on Masonic principles.,16849,2024-07-02 17:15:01,1
"According to David Icke, Saturn is actually a huge broadcasting system which sends electromagntic waves to Earth and so creates the ""matrix"" in which we all live.",16851,2024-12-08 15:15:01,1
The elite here on Earth know of the importance of Saturn as well as its true history.,16852,2024-12-22 13:45:01,1
"After 100 years the Rockefeller ""project"" has finally been completed. Not ONE free and independent voice at ANY university in the world. Silent out of complicity or openly shilling for our oppressors -  academics should be treated for what they are; traitors and hypocrites.",16853,2024-07-26 21:15:02,1
Global pedophilia scandals have been revealed and summarily disregarded for decades.,16855,2024-05-06 01:15:01,1
Mind control victims are abused very tramatically in order to make them disassociate from reality.,16856,2024-10-21 15:15:02,1
Google manipulates mankind by hiding certain information and imposing other information. They blacklist thousands of websites.,16857,2024-12-08 19:45:01,1
Control of the seed is control over the entire food supply. They are using intellectual property to take the worlds food supply hostage.,16858,2024-07-01 18:15:02,1
"They announce their plans before they do it, it's the secret. By announcing and acting like it already has happened, the universe responds by making it a reality. I'm a millionaire by the way!",16859,2024-11-30 10:45:01,1
"Claimed members of the Vril Society: Adolf Hitler, Alfred Rosenberg, Heinrich Himmler, Hermann Goring, and Dr. Theodor Morell.",16860,2024-09-05 01:45:01,1
"According to Mystery Schools, words and names hold certain amounts of energy. Key words give power to shape reality simply by speaking them.",16862,2024-07-18 14:15:01,1
It's funny to me how people think the Catholic Church isn't run by Satanists. They're all NWO affiliated. Many attend WEF summits and they're all involved in child abuse and money laundering. Literally a criminal organisation.,16863,2024-12-20 17:15:02,1
"Magic spells are often inserted into the lyrics of songs, especially from popular or mainstream artists.",16864,2024-09-09 22:45:02,1
Wayfair and Child Trafficking? The Rabbit Hole Goes Deep: https://vigilantcitizen.com/vigilantreport/wayfair-and-child-trafficking-the-rabbit-hole-goes-deep/,16865,2024-09-01 19:45:01,1
We Need to Talk About That CNN Director Admitting That His Network is Propaganda: https://vigilantcitizen.com/latestnews/we-need-to-talk-about-that-cnn-director-admitting-that-his-network-is-propaganda-video/,16866,2024-12-26 01:45:02,1
Paris Hilton's Documentary Reveals That She Was Subjected to MKULTRA-Style Abuse: https://vigilantcitizen.com/moviesandtv/paris-hiltons-documentary-reveals-that-she-was-subjected-to-mkultra-style-abuse/,16867,2024-12-28 13:45:02,1
The Occult History of the U.S. Military's PSYOPS and its Highly Symbolic Recruitment Video: https://vigilantcitizen.com/vigilantreport/ghosts-in-the-machine-the-highly-symbolic-video-by-the-u-s-armys-psyop-division/,16868,2024-12-24 04:15:01,1
The Orwellian Agenda to Control Thought by Limiting Language: https://vigilantcitizen.com/vigilantreport/the-war-on-words-how-the-elite-is-attempting-to-control-thought-by-banning-words/,16869,2024-10-30 08:15:01,1
The Story of Elizabeth Bathory - Proof That the Occult Elite Has Been Sick For Centuries: https://vigilantcitizen.com/vigilantreport/the-story-of-elizabeth-bathory-is-proof-that-the-occult-elite-has-been-sick-for-centuries/,16870,2024-07-17 08:45:01,1
"Knowledge and belief systems have been handed down over the centuries through secret society networks, the same ones that control religion, business, and politics in the modern world.",16872,2024-07-18 02:15:01,1
"Always go too far, because that's where you'll find the truth.",16873,2024-11-15 08:45:01,1
So much of what the Federal Government does needs to be defunded.,16874,2024-07-05 06:15:01,1
"Is anyone actually investigating Klaus Schwab? 

Seriously, anybody?",16875,2024-11-30 05:15:01,1
You have no idea how deep the rabbit hole goes.,16876,2024-09-03 23:15:01,1
I am suspicious of all the things that the average people believes,16877,2024-11-09 16:15:01,1
There are dozens of Masonic handshakes and signs. The first 3 degrees of Freemasonry (Blue Lodge) alone have 5 grips and 7 different signs.,16878,2024-12-14 13:15:01,1
"If we look at some of the world's most important ancient sites on a map, we can draw straight lines between one and another. These lines end up forming a grid-like pattern across the entire globe. Stonehenge, the Great Pyramid of Giza, and Machu Picchu.",16879,2024-11-02 18:45:01,1
"Somewhere out there Ghislaine Maxwell's clients are sitting in their mansions completely unafraid of prosecution. Damn shame, ain't it?",16880,2024-10-18 00:45:02,1
"people are like ""I'm not going to eat the crickets.""

oh you're gonna eat the crickets, brother. they're gonna be everywhere. they're gonna put em in Hot Pockets. your kids are gonna be like ""mom! i want the pizza crickets!""",16881,2024-09-09 14:45:01,1
Now virtually all local news channels are owned by the same handful of corporations,16883,2024-11-21 03:15:01,1
NASA has a whole division dedicated to editing photos and screening them before they are fit for public consumption.,16884,2024-10-21 20:45:01,1
"I highly recommend the Zero Point documentary series for extending your horizons.

1. https://www.youtube.com/watch?v=6-ALZxiCi9Q
2. https://www.youtube.com/watch?v=DevtvLEFU4s
3. https://www.youtube.com/watch?v=oqKEpbZf1qo
4. https://www.youtube.com/watch?v=YcdlMZuPUjA

Watch them while you still can. ",16885,2024-12-25 06:15:01,1
"The New World Order means the end of freedom, as we know it, and the dawning of a new dark age for man.",16888,2024-07-24 23:15:01,1
"Most people do not want to admit, or even believe, that they were duped, and that their perception of reality is false.",16889,2024-07-08 11:45:01,1
I need new conspiracy theories. All my old ones came true!,16890,2024-11-13 06:45:02,1
Bees and monarch butterflies are taking a serious hit as glyphosate wipes out just about every plant that makes honey production possible.,16891,2024-10-07 16:15:01,1
"Even if a conventional farm converts to organic, glyphosate can stay in their soil for over 20 years.",16892,2024-09-26 17:45:01,1
"The NSA is the largest employer of mathematicians in the United States, and possibly the world.",16893,2024-10-08 04:15:01,1
The Hidden Life of the Kennedys: The Elite Dynasty That Got Decimated http://vigilantcitizen.com/vigilantreport/kennedys-elite-dynasty-got-decimated-pt/,16894,2024-12-08 15:45:01,1
"SAG (stratospheric aerosol geoengineering) AKA, ""chemtrails"", are virtually shredding the ozone layer day in and day out.",16896,2024-12-10 21:15:02,1
The Most Important Topic of Our Time - GeoEngineering & Chemtrails: https://www.youtube.com/watch?v=a2x6TEeknfo,16897,2024-10-05 12:15:01,1
Geoengineering & Chemtrails Presentation by David Lim: https://www.youtube.com/watch?v=2gzCwk1xLxo,16898,2024-10-18 14:45:02,1
Geoengineering And The Collapse Of Earth: https://www.youtube.com/watch?v=1x8BVyodH0Y,16899,2024-07-27 17:45:01,1
Anyone who says geoengineering is not real is wrong.,16900,2024-08-09 15:15:01,1
Just one black budget project may get more funding than all the universities on earth combined. ,16902,2024-10-14 13:45:01,1
"""Control the oil, and you control nations. Control the food, and you control the people."" ~ Henry Kissenger",16904,2024-12-24 05:15:01,1
"The Illuminati is a good series, good for waking people. If you haven't seen it you should: https://www.youtube.com/watch?v=pmzUKHiLFcI",16905,2024-10-20 09:45:01,1
"The Illuminati is a good series, good for waking people. If you haven't seen it you should: https://vimeo.com/52740993",16906,2024-08-03 00:15:01,1
"The Illuminati maintain hidden libraries full of ancient treatises on demonology, which they avidly study. Some of the most important books are the ""Sixth and Seventh Book of Moses"", ""The Black Raven"", ""The Spring Book"", ""The Spiritual Shield"".",16909,2024-10-17 05:15:01,1
"""Power is in tearing human minds to pieces and putting them together again in new shapes of your own choosing."" ~ George Orwell",16911,2024-06-06 12:45:01,1
"Why are the rates of obesity, autism, and other diseases skyrocketing?",16912,2024-11-10 22:15:01,1
"In 1954, a marine corps naval aviator, writer, and UFO researcher named Donald Keyhoe said that the U.S. Air Force had detected two satellites orbiting Earth. This was 3 years prior to the first human made satellite, Sputnik 1, being launched.",16913,2024-11-02 22:15:01,1
"The Black Knight satellite is believed to be an artificial satellite, just not one with human origins.",16914,2024-06-12 12:15:01,1
One theory suggests that the Black Knight satellite isn't alien but actually an ancient human creation. The idea here is that an ancient race of humans (or other intelligent animals on Earth) were scientifically advanced and launched the satellite before becoming extinct.,16915,2024-08-01 06:15:01,1
"Scientists who discover problems with GMOs have been attacked, gagged, fired, threatened, and denied funding.",16917,2024-09-24 21:45:01,1
GMOs cross pollinate and their seeds can travel. It's impossible to fully clean up our contaminated gene pool. The potential impact is huge.,16918,2024-12-14 10:15:01,1
"In Europe, occult leaders were told as early as the 1740's that the new American continent was to be established as the ""new Atlantis"".",16919,2024-12-26 10:45:01,1
"In Europe, occult leaders were told as early as the 1740's that the new American continent was to be established as the ""new Atlantis"". The USA, aka New Atlantis, was founded on the basis that it would later be destroyed, to fulfill one of history's darkest agendas.",16920,2024-09-23 19:15:02,1
"CIA = Microsoft
CIA = Apple
CIA = Google
CIA = Cisco
CIA = All major US tech companies",16921,2024-11-24 05:15:01,1
