tweet,id,last_tweeted,active
"Believe it or not, most people would be deeply concerned about government corruption but their brains are too full of propaganda, fluoride, heavy metals, and processed food to form any rational thoughts.",18168,2024-07-05 13:15:01,1
"The truth is no longer hidden
Now people are hiding from the truth",18169,2024-08-04 05:15:01,1
"What if I told you that no matter how much information you share with your friends about the corrupt government and our liberties disappearing, 97% just won't care until it is too late and only then will they wonder how we allowed this to happen.",18170,2024-10-19 10:15:01,1
"Governments worldwide are struggling to contain a new virus that would have a huge impact on billions of lives. 

This virus is called TRUTH",18171,2024-08-03 03:45:02,1
What if I told you it's all just a big psychological operation?,18172,2024-06-28 01:15:01,1
The Tavistock Institute is manipulating the minds of billions of people.,18173,2024-10-21 20:15:01,1
The only reason why the government would want to disarm you after 247 years is because they intend to do something that you would shoot them for,18174,2024-12-23 07:45:01,1
"If you haven't found the rabbit hole by now, you're not looking for it.",18175,2024-12-07 05:15:01,1
Why pay taxes when they can just print infinite money?,18177,2024-10-31 00:15:02,1
"Biden's laptop was a ""conspiracy theory"" and look where we are now.",18178,2024-05-14 14:45:02,1
Stop supporting the Satanic pedophiles that run the entertainment industry,18182,2024-07-21 09:45:01,1
[They] are going above and beyond to promote the devil and it's pissing me off ,18183,2024-07-17 12:45:01,1
Bill Gates is satanic... look into it,18186,2024-10-19 14:45:01,1
Klaus Schwab is satanic... look into it,18187,2024-09-20 11:45:01,1
Hillary Clinton is satanic... look into it,18188,2024-08-19 02:45:02,1
Hollywood Is 100 times more evil than you think it is,18189,2024-10-22 06:45:02,1
Area 51 includes a massive underground facility ,18191,2024-12-04 02:15:01,1
Klaus Schwab and his cronies are operating with the belief that they are literally gods. ,18192,2024-10-21 00:15:01,1
"The globalist elite cannot stop talking about their plot to depopulate the world, and now they are becoming specific with their plans. ",18193,2024-12-05 03:15:02,1
The WEF is laying the groundwork to take over every aspect of our lives.,18200,2024-08-04 08:45:02,1
"Soon unborn children will undergo gene editing under the guise of eliminating diseases and disabilities, but the real reason will be to install psychological traits into the next generation which the elite approve of such as submissiveness and compliance with authority.",18201,2024-10-14 22:15:01,1
"Not content with just editing genes via mRNA jabs, the elites are now threatening to edit the genes of our unborn children.

To perpetrate this crime against humanity, they have been developing artificial wombs which will be able to develop a fetus outside of a mother's body.",18202,2024-10-20 17:45:01,1
Only a select fraction of the earth's current billions of inhabitants will be lucky enough to survive the coming great depopulation.,18203,2024-07-17 13:45:01,1
"The WEF has been excitedly declaring that ""God is dead"", and the WEF are ""assuming divine powers of creation and destruction"", and the mainstream media has completely ignored their evil agenda.",18204,2024-10-16 04:15:01,1
"While the mainstream media have provided cover for these psychopaths, the elite have been allowed to work towards the eradication of our sovereignty at national and individual levels. This is serfdom 2.0. ",18205,2024-09-27 05:45:01,1
"[They] have admitted that their intention is to deprive us of everything, consume insects as food, reside in confined spaces, and be desensitized by virtual reality devices and pharmaceutical drugs. In this future, the  global state will own everything. They will even own us.",18206,2024-07-22 04:45:01,1
Klaus Schwab has said multiple times that the CCP's China is the model for the future of the world. Is that a world you want for your children and your children's children?,18207,2024-10-06 08:45:01,1
"At this hour, it is not hyperbole to say that our most basic freedoms,  and the freedom of future generations, depend on how we respond to the threat of this globalist coup.",18208,2024-08-10 07:15:01,1
"The media is the propaganda arm of the globalist elite. They love to pontificate about ""democracy"" and ""rights"" while working tirelessly to centralize power and eliminate individual sovereignty.",18210,2024-11-29 22:15:01,1
"Wouldn't they technically own anyone who has gotten the jab? It changes genetic material in the body - it's patented - so aren't the jabbed now under that patent?   

Like how Monsanto would screw over organic farmers when their patented GMO seeds would blow onto a farmers land",18211,2024-09-24 12:15:01,1
Everything you see on tv and in movies is a scripted performance with the purpose of shaping your world view to benefit the powerful interests running the show.,18212,2024-12-17 02:15:01,1
"I no longer identify as a ""Conspiracy Theorist.""
You can now refer to me as

""That guy that was right all along.""",18213,2024-11-11 07:45:02,1
"The world will be in the hands of an increasingly shrinking pool of mega-corporations like BlackRock. To be managed, controlled, and exploited by a group of people with no loyalty to a nation, borders, religion, or people.",18214,2024-11-24 23:15:02,1
"The Unabomber, a math genius who was granted a scholarship to Harvard at the age of 16, has been revealed as a CIA MK Ultra mind control subject. ",18216,2024-07-29 19:45:01,1
My Alex Jones was right jar is over flowing,18219,2024-11-04 03:15:01,1
"Not all men are interested in talking about sports. Some men prefer talking about freedom, exposing the evil in the world & standing up for future generations.",18222,2024-08-02 05:15:01,1
Sports are a distraction to keep the masses entertained while the 1% runs the show,18223,2024-07-08 14:15:01,1
What if I told you all presidents are only frontmen to distract you from the people who really run the country?,18224,2024-12-20 19:15:02,1
"Those who seek the truth about the world will realize that its reins are held by an unelected elite, one that is hidden from the public eye.",18225,2024-12-23 23:45:01,1
"A lie doesn't become truth, wrong doesn't become right & evil doesn't become good, just because it's accepted by a majority.",18226,2024-12-27 17:15:01,1
Scientists Warn Toxic Microplastics Now Getting Stuck in Our Airways: https://www.newsweek.com/toxic-microplastic-pollution-stuck-airways-1806214,18233,2024-07-20 19:45:01,1
They are MURDERING you,18234,2024-09-02 17:15:01,1
Plastic is far more toxic than we thought: https://www.fastcompany.com/90649480/there-are-thousands-more-toxic-chemicals-in-plastic-than-we-thought,18235,2024-09-19 22:15:01,1
"Remember, if you want to exert control over something, you need to purchase or control only a few key individuals, the others will blindly follow.",18236,2024-07-08 14:45:01,1
they destroyed our history and told us fairy tales and wrote fake books,18237,2024-11-26 22:45:02,1
"Remember, if it's connected to the internet it can be used to spy on you.",18238,2024-12-08 08:15:02,1
"Let me tell you the plan:  

1. Cash is replaced with central bank digital currency  

2. It will be stored in a digital wallet you access with your digital ID  

3. The state has full control over what you spend your money on  

4. Personal carbon tracking on your purchases

",18239,2024-10-20 08:45:02,1
"Freedom is not just about walls and bars, but also about mindset. The best way to keep a prisoner captive. is to ensure they never realize they're in prison.",18240,2024-10-20 03:15:01,1
"1 week into eating healthy: I hate my life  
1 month into eating healthy: I feel great  
3 months into eating healthy: Why is everything poisoned 
6 months into eating healthy: Nothing they say is true. Everything is a scam 
1 year into eating healthy: I have no friends",18243,2024-12-27 21:45:01,1
Why is there a hexagram on the north pole of Saturn?,18244,2024-11-08 19:15:01,1
Wild how Bill Gates got divorced from his wife because of his ties to an international sex trafficking ring and everyone just breezed past that to hear his psychopathic ideas on disease and hunger.,18245,2024-11-09 23:45:01,1
"If you really want to change the world...

Teach children to grow their own food",18246,2024-11-03 05:15:01,1
"If you really want to change the world...

Teach children to question authority ",18247,2024-12-25 15:45:02,1
You are having your purchasing power silently stolen from you via inflation,18249,2024-08-10 12:45:01,1
Look into the Podesta emails. Look into spirit cooking. Your reality is fake. The Clinton's are not nice people. I'm not even sure they are people.,18252,2024-10-18 14:15:01,1
"It's all a scam folks

Covid, climate change, elections, all of it.",18253,2024-11-22 12:15:02,1
"Total revolution of consciousness and our entire social, political and economic system is what interests me, but that's not on the ballot.",18255,2024-07-18 17:15:01,1
The job of the mainstream media today is to make you think that the views of 10 percent of the country are actually the views of 90 percent of the country.,18257,2024-09-08 06:15:01,1
5 Pieces of Monsanto's History We're Not Supposed to Think About: https://www.thelastamericanvagabond.com/5-pieces-monsantos-corporate-history-not-supposed-think/,18259,2024-09-24 17:15:01,1
"For the record, I am not suicidal. I am not crazy. I just want the truth. ",18261,2024-08-12 09:15:01,1
I need your help dismantling a 9000 year old devil worshiping pedophilia cult,18264,2024-09-25 08:45:01,1
Don't ask why healthy food is so expensive. Ask why junk food is so cheap.,18265,2024-11-20 18:15:01,1
"Government agencies have been secretly manipulating the weather for decades, and worse yet, without our permission.",18270,2024-09-25 21:45:01,1
Anyone else notice the unvaxxed aren't dying?,18271,2024-06-10 21:45:01,1
They always play both sides. You just haven't figured it out yet. ,18273,2024-12-20 14:15:02,1
President Obama holds the world record for the most children killed by a Nobel peace prize winner.,18275,2024-10-06 21:15:01,1
The most frightening part about waking up is finding out most people around you don't care...,18276,2024-10-14 19:15:01,1
Good thing Hunter Biden didn't do anything serious like trespass at the Capitol while wearing a moose head.,18278,2024-12-23 17:15:02,1
Happy slaves are the biggest enemy of freedom.,18280,2024-05-08 00:15:01,1
Virtually the entire human race is hypnotized because they think what someone else told them to think.,18281,2024-11-01 02:15:01,1
Does anybody actually think that Biden is running anything?,18283,2024-10-06 06:45:01,1
"The UN's New Fact-Checking System Called ""iVerify"" Will Be Used To Crack Down On ""Misinformation"" All Over The World: https://endoftheamericandream.com/the-uns-new-fact-checking-system-called-iverify-will-be-used-to-crack-down-on-misinformation-all-over-the-world/",18286,2024-10-05 18:15:01,1
It's time to wake up!,18288,2024-12-20 02:15:01,1
The goalposts will keep moving as long as they know you'll obey.,18289,2024-07-07 20:15:01,1
If you are healthy they lose money,18290,2024-08-05 19:15:01,1
1% control the world. 4% are puppets. 90% are asleep. 5% know what is going on and are trying to wake up the 90%. The 1% don't want the 5% waking up the 90%.,18291,2024-11-27 07:15:02,1
People will hate you for not being a brainwashed slave.,18292,2024-09-08 13:15:01,1
"In 2011 a researcher by the name of Daniel Hirsch wrote  a Report titled ""Health Impacts of Radio Frequency from Smart Meters"". Hirsch found that the cumulative exposure of a smart meter is more than 160 greater than that of a cellphone.",18293,2024-11-14 12:15:01,1
"Even the minimum exposure from a cell phone is still 80 times less than the minimum exposure from a smart meter at 10 feet, which is less than the distance through the wall into your bedroom or your child's room.",18294,2024-11-24 01:45:01,1
"We choose many of the EMF radiation risks around us, like our cell phones, routers, etc. One problem with smart meters is that we dont choose to have them on our home, the utility companies do. This is not only a massive invasion of our privacy but a proven health hazard.",18295,2024-07-12 14:45:01,1
"Smart meters are extremely dangerous, and even the the World Health Organization has classified them as a possible carcinogen.",18296,2024-12-04 22:45:02,1
"The primary problem is that Smart Meters emit such an enormous amount of radiation, that is capable of penetrating the walls of your home and impacting your health. These transmissions happen 24 hours a day.",18297,2024-12-10 00:45:01,1
"Both cell phones and smart meters use radio frequency transmissions to send data to cell towers. Smart meters emit far more radiation, but this radiation is usually farther away, so its a bit tough to say which one is worse.",18298,2024-11-24 06:15:02,1
The cumulative whole-body exposure from a Smart Meter at 3 feet appears to be approximately two orders of magnitude higher than that of a cell phone.,18299,2024-07-04 17:15:01,1
New documents indicate the entire justification for vaccine mandates was based on a lie - and that public health officials knew it: https://www.washingtonexaminer.com/opinion/new-emails-show-covid-vaccine-mandates-were-based-on-a-lie,18300,2024-11-10 08:45:01,1
In 1913 the IRS TAX was only intended to be TEMPORARY to finance WWI...,18304,2024-08-04 09:15:01,1
"In these harsh economic times, it is important to remember...

Every 5G tower consists of 11 pounds of copper, and 1 pound of platinum",18306,2024-12-05 01:45:01,1
"Blackrock gets half a trillion dollar deal to ""rebuild"" Ukraine.  

What a spontaneous & shocking coincidence.

https://humanevents.com/2023/06/19/blackrock-jp-morgan-set-up-reconstruction-bank-for-ukraine",18308,2024-07-17 17:45:01,1
Planned Parenthood executives have been caught harvesting the organs and body parts of children for the VIP elite  and boasting about the luxury items and lavish lifestyles that the trade in dead children affords them.,18309,2024-08-03 16:45:01,1
"Actor Jim Caviezel, who played the role of Jesus in Mel Gibson's epic Passion of the Christ, has gone on record admitting that children are being kidnapped and trafficked by Hollywood elites.",18310,2024-07-05 03:45:01,1
"At least 90% of processed foods, including organic, now contain mind-numbing, obesity-inducing CANOLA OIL: https://www.naturalnews.com/2023-06-22-90percent-all-processed-food-contains-canola-oil.html",18311,2024-10-14 12:45:01,1
"NHS Whistleblower: ""We were ordered to Euthanise Patients to falsely increase COVID Death Counts"": https://expose-news.com/2023/06/23/nhs-whistleblower-confirms-euthanisia-covid-lies/",18312,2024-12-25 02:45:01,1
"The elite have been sacrificing children as part of ancient pagan rituals for centuries and the global elite are still caught up in this evil, using adrenochrome as part of depraved occult rituals to get high and stay young",18314,2024-08-06 04:45:01,1
"In 2016 WikiLeaks emails confirmed what many people had long suspected  Hillary Clinton worships Moloch, the pagan god of child sacrifice.",18315,2024-11-24 06:45:01,1
"Hollywood studios are ""drenched in the blood of innocent children"" according to Mel Gibson who claimed the consumption of ""baby blood is so popular in Hollywood that it basically operates as a currency of its own.""",18316,2024-10-20 07:15:01,1
Big pharma and the FDA have a history of prioritizing profits over people.,18318,2024-10-16 14:45:01,1
The American justice system is rigged by the deep state and the people are getting sick of it. ,18319,2024-07-17 04:45:01,1
"Once you're vaccinated, you cannot become unvaccinated. You cannot detox from it. It is an irreversible thing.",18321,2024-11-06 20:45:01,1
Make no peace with evil,18322,2024-07-22 12:45:01,1
"In 1898, Morgan Robertson wrote a novel about a fabulous Atlantic liner called the Titan, far larger than any that had ever been built, that sinks after it collides with an iceberg. The details of the book bear a chilling resemblance to the Titanic disaster fourteen years later.",18323,2024-10-21 06:45:01,1
"The elites tell us what their plans are through their books, publications and movies. This is called Revelation of the Method. If you are too stupid to recognize it for what it is that is your problem from their point of view. It is a form of ritual mocking.",18324,2024-10-15 17:15:01,1
"Don't you think it's crazy that folks blame disease on heritage and genetics and not the proven fact that our food, water, and air are being systematically poisoned?",18325,2024-12-09 20:45:01,1
The CIA tortured veterans on god tier acid trips for 20 years.,18326,2024-11-07 01:15:02,1
What the heck are they doing in Antarctica?,18327,2024-11-30 21:15:01,1
"Oklahoma governor Frank Keating's brother Mark wrote a novel about a man named Tom McVey blowing up a building in Oklahoma City, who was later apprehended because he committed a minor traffic violation... years before that very scenario played out with Tim McVeigh",18328,2024-07-02 04:45:01,1
"Scew all you appeal-to-authority morons who actually think it's ""anti-science"" to question vaccines.",18334,2024-09-25 09:15:01,1
The most frightening part about waking up is finding out that nobody seems to notice. Nobody seems to care.,18335,2024-11-20 06:45:01,1
How many cures for cancer and other diseases does the government have locked up?,18336,2024-12-17 00:45:02,1
"It's all out in the open, most people are just too brainwashed to see it.",18337,2024-10-08 13:15:02,1
Normies are being culled. Ever notice how no healthy or positive behaviors are being normalized anymore? That's why.,18338,2024-10-17 10:15:01,1
"Do you know where the term ""mortgage"" originally comes from? It originates from Latin, meaning ""death pledge"".",18339,2024-09-16 02:15:01,1
Merck downplayed severe psychological side-effects of its blockbuster children's asthma drug: https://www.dailymail.co.uk/health/article-12235147/Merck-downplayed-severe-psychological-effects-blockbuster-childrens-asthma-drug.html,18340,2024-06-16 22:45:02,1
What if I told you that the government is literally waging war against us? Look into 5th generation warfare. ,18341,2024-11-12 21:45:01,1
Bill Gates is the real problem,18342,2024-11-21 16:15:02,1
War is when your government tells you who the enemy is. Revolution is when you figure it out for yourself.,18343,2024-12-10 19:45:01,1
"""EVERGREEN"" is Hillary's Secret Service code name...

It's also the name of a shipping company that transports children, drugged and boxed up in containers marked, ""Live Art"" - for delivery to Elite Pedophiles for possible organ harvesting, rape, torture and sacrifice!",18344,2024-10-21 17:15:01,1
People not liking you isn't oppression. ,18345,2024-11-25 14:15:02,1
Do you get it yet? They create your problems. They observe your reactions. Then they offer you their solutions.,18346,2024-08-04 06:45:01,1
"In other news, Ghislaine Maxwell becomes the first person ever to be convicted of trafficking children to nobody!",18347,2024-07-10 06:45:01,1
"No one will ever trust a politician, a reporter, a doctor, a nurse, a radio station, a newspaper or a scientist ever again. The old system is dying because it's based on death and deceit.",18348,2024-11-14 21:45:01,1
"Dean Burk, for many decades Chief Chemist at the National Cancer Institute, testified at congressional hearings in 1981 stating that over 40,000 cancer deaths that year were attributable to fluoride. He has said that no chemical causes as much cancer, and faster, than fluorides,",18349,2024-07-17 09:15:02,1
"There is not a SINGLE biological process that requires fluoride.

This means fluoride does NOT help your body do one single positive thing. So any fluoride you ingest is only going to increase the risk of harm but provide you zero benefits.",18350,2024-12-21 05:15:01,1
Klaus Schwab is the real problem,18351,2024-12-22 21:15:02,1
"Before you listen to Bill Gates about anything, remember he visited Epstein's island at least 17 noted times.",18352,2024-09-04 00:15:02,1
"Do you honestly believe that WEF/UN/WHO are installing 5G towers so we can have better internet? 

Do you really believe the forced 'vaccines' from Bill Gates were meant to keep us healthy? 

Does anyone truly believe that taxing us into poverty will change the weather?",18353,2024-07-26 18:45:01,1
"Remember...if all the headlines are identical, it's not news, it's advertising.",18354,2024-06-16 21:45:01,1
"I will never trust anyone in the medical field again.  

They caused harm for money. They stayed silent while patients died. They made dance videos while patients suffered. They falsified notes in the charts of those who refused.",18355,2024-07-20 07:15:01,1
"No matter what society says, it's okay to be like, ""Nah that ain't for me""",18356,2024-07-07 22:15:01,1
The big question is why isn't Bill Gates in jail at this point? Why hasn't he been put in front of Congress?,18357,2024-11-02 22:45:01,1
"Climate Change - the made up catastrophe used by globalists to instill fear and guilt so they can tax, regulate, and remove our freedoms while pretending to be saving the planet.",18364,2024-11-19 12:15:01,1
"The problem isn't that we don't have access to truth

It's that most people don't want to hear it",18365,2024-12-27 18:15:01,1
"When people rob banks they go to jail

When banks rob people they get fricking bonuses",18366,2024-07-24 05:15:01,1
"Have you all noticed, the unvaccinated are still here?",18376,2024-12-14 17:45:01,1
When the corporations are advertising your movement you aren't the resistance.,18377,2024-08-10 11:15:01,1
James Bond really accurately predicted that the biggest threat to life on earth is super rich businessmen whose money didn't make them happy and now their hobby is destroying the world.,18378,2024-11-04 23:15:01,1
"The most powerful governments in the world can't solve homelessness.

But they can change the earths temperature if you pay them more taxes...",18379,2024-08-05 12:45:01,1
"Pfizer CEO Albert Bourla is a veterinarian. Albert Bourla's PhD thesis is about the control of fertility in sheep and goats.

I'm serious. You can't make this stuff up. You really can't.",18380,2024-11-10 01:15:02,1
"Central Bank Digital Currency will be programmable... ultimately giving the government control over *how it is spent by the recipient*... your freedom to purchase fuel, meat, flights, fertilizers will be limited to a carbon credit score.",18381,2024-09-21 19:45:01,1
"There is nothing more offensive than billionaires flying private jets to a remote Swiss village, dining on Wagyu filets and the world's finest wines, while telling you to turn down your thermostat, stay within 20 miles of your home, and eat insects for dinner.",18382,2024-11-15 08:15:01,1
"We've spent billions of dollars to set up solar farms, now they're talking about spending billions of dollars to block out the sun

That's a special kind of stupid",18383,2024-11-11 23:45:01,1
I wonder why there are no women transitioning to men so that they can compete in men's sports.,18384,2024-07-15 13:45:01,1
"Every time you buy something, you make BlackRock and Vanguard richer.",18385,2024-12-08 02:45:01,1
"There is a giant eyeball floating above an Egyptian pyramid printed on the dollar

And yet people still think the Illuminati are a myth",18386,2024-12-27 08:45:01,1
"Bill Gates knew his ""vaccines"" caused cancer and hes also selling meat laced with cancer while blocking the sun to fight ""Climate Change"" which will cause cancer. Everything Gates touches turns to cancer...",18390,2024-08-09 11:45:01,1
"If you live from the system, you are beholden to it. You get strings.",18391,2024-12-07 17:15:01,1
What do you think was the most successful lie ever told?,18392,2024-09-23 14:15:02,1
What do you think is the most successful conspiracy ever perpetrated? ,18393,2024-10-29 21:15:01,1
"What's never been proven, but taught as fact?",18394,2024-11-29 21:15:01,1
Every politician with ties to the World Economic Forum should be arrested on suspicion of high treason.,18410,2024-09-11 11:45:01,1
The TRUTH doesn't care what your opinion is.,18412,2024-12-11 00:15:02,1
"We know for a fact that Obama flew in $65,000 worth of ""hotdogs and pizza"" for a private White House party using clandestine channels.

We also know, thanks to WikiLeaks emails, that the FBI has identified ""hotdogs and pizza"" as pedophile code words.",18413,2024-09-21 14:45:01,1
There is a special place in hell for those who harm children and animals.,18415,2024-12-24 14:15:01,1
Covid was a test to see how far you'd comply. ,18416,2024-11-24 11:45:02,1
"Dear children of the world

It's not supposed to be like this.",18417,2024-08-16 13:45:01,1
"Alex Jones, RFK Jr., and Tucker Carlson all agree: Gender-bender chemicals in water are turning animals gay: https://www.naturalnews.com/2023-07-19-tucker-carlson-chemicals-water-animals-gay.html",18420,2024-10-17 08:15:01,1
Unlabeled GMO salad greens coming to a grocery store near you: https://www.naturalnews.com/2023-06-12-unlabeled-gmo-salad-greens-coming-grocery-stores.html,18421,2024-09-09 00:45:01,1
"If you know the truth, at this point you have a responsibility to speak it, because this is a number's game and the dark thrives on good people doing and saying nothing.

This is an all hands on deck moment for humanity - they're counting on most people staying silent.",18423,2024-09-03 10:15:01,1
"Hunter Biden trafficked prostitutes across state lines, paid for them from his law firm's bank account, and then tried to write it off on his taxes.

Ladies and gentleman, this is called TAX FRAUD. Of the highest degree.",18424,2024-12-24 19:45:01,1
