tweet,id,last_tweeted,active
Okay so I stole a bitcoin atm. How do I get the bitcoins out?,12249,2024-10-24 02:30:01,1
Rollups already have a token. It's called ETH.,12252,2024-10-17 01:30:01,1
"Vitalik: bitcoiners decided to scale with the lightning network, an unproven new tech...

Proceeds to explain how eth will scale with:
Pos
Sharding
Rolloups",12260,2024-11-22 03:30:01,1
Julian Assange is still sitting in prison for exposing US war crimes.,12261,2024-10-27 11:30:02,1
"Ransomware, but all it does is randomly switch commonly-confused homophones (e.g., their/there/they're or affect/effect) for all your emails and web pages, until you can't take it anymore and just pay up.",12274,2024-12-01 09:30:01,1
"Reminder that Wikipedia is swimming in money - more than 10 times what they'd need to run the website. They're employing over 40 people *just* on fundraising. Managers get $400k salaries.

Their intrusive donation plea banners are downright deceptive.",12275,2024-12-27 21:30:02,1
"Am I testing my code

or is it testing me",12276,2024-12-19 18:30:01,1
Always assume that the user is up to no good.,12277,2024-12-19 21:30:02,1
Wikipedia Is Rich. Why Is It Fundraising? https://www.dailydot.com/debug/wikipedia-endownemnt-fundraising/,12278,2024-12-14 14:30:01,1
"70% of people in El Salvador have no bank account.

But go on, continue criticizing their one chance for hope, #Bitcoin",12280,2024-11-14 10:30:01,1
"#Bitcoin is already over 3 times greener than the United States, and it's only getting greener by the block.",12284,2024-10-02 09:30:01,1
"The #Bitcoin energy debate is not about power consumption, it's about power",12285,2024-10-09 13:30:01,1
"#Bitcoin for the billions, not the billionaires.",12286,2024-12-21 14:30:01,1
"#Ethereum will see a 99.95% reduction in energy usage with proof-of-stake.

Why Elon doesn't jump on that makes zero sense to me.",12292,2024-11-01 16:30:02,1
"The reason many people don't get crypto is because they're too busy looking for technical innovation rather than institutional innovation.

The most exciting attributes of blockchains are about how we design and run internet institutions, not computational performance.",12296,2024-10-17 17:30:01,1
"I have an insane amount of respect for builders that are able to focus on doing real and impactful work even amongst all the craziness of the crypto industry.

They're the real MVPs.",12299,2024-12-17 00:30:01,1
"When you realize that #bitcoin has no top, because fiat has no bottom you will feel the fear exit your body and be at peace with your BTC HODL!",12302,2024-11-28 19:30:01,1
There are loads of great #crypto gems under a 50 million dollar market cap!,12305,2024-10-24 08:30:01,1
"It should be obvious, but low cap alts are uber high risk. If the market tanks expect them to do -90%. The upside is that they can do 20 to 100X. ",12306,2024-11-02 08:30:02,1
Satoshi's #bitcoin makes him the 36th richest man in the world at current prices.,12307,2024-12-12 13:30:02,1
If Satoshi were to show back up and start selling some of his 1 million #bitcoin would it change your opinion of BTC?,12308,2024-11-05 04:30:01,1
"A few developers and a bit of code can disrupt the most powerful banks on the planet

That's DeFi",12316,2024-11-26 21:30:02,1
"We're not waiting around for the institutions to come.

We're rebuilding the institutions.

That's what they don't understand.",12317,2024-11-29 13:30:02,1
If you're the smartest person in the room you're in the wrong room,12320,2024-12-10 09:30:01,1
"bitcoin can succeed without gold

ether can succeed without bitcoin",12322,2024-12-19 19:30:01,1
"PSA: For the 11th time, tokens are not shares, blockchain projects are not publicly traded companies.",12325,2024-10-12 14:30:01,1
"I used to have to wait until Monday to lose money in the markets but, thanks to cryptocurrency, I can lose money all weekend long.",12330,2024-11-30 10:30:01,1
Do people actually believe the FBI has a secret quantum computer that can break SHA256 at will & the way they chose to out themselves was by...seizing a few dozen BTC?,12332,2024-11-16 04:30:01,1
"Remember the first company to add Bitcoin to their balance sheet? Critics said it was a tiny company and doesn't matter.

Now we have the first country accepting Bitcoin as legal currency. Critics saying it's a tiny country and doesn't matter.

We all know what happens next...",12333,2024-12-29 04:30:01,1
"Two levels of misunderstanding about smart contracts for Bitcoin:

a) They're not possible, and
b) They're only possible as sidechains.

Directly using Bitcoin's security and capital in smart contracts is very powerful and entirely possible.",12335,2024-11-27 20:30:01,1
"For those of you who think the US gov't cracked SHA-256 and correctly guessed the private key of the Colonial Pipeline hackers, here's a fun fact:

The size of bitcoin's private key space is 10^77. For comparison, the amount of *atoms* in the observable universe is 10^80.",12336,2024-12-02 06:30:02,1
"#Bitcoin consumes energy to protect its users from the corruption & stupidity of our political leaders, their utter destruction of the economy & our livelihoods.

Dear politicians: The reason it consumes so much is because of how powerfully stupid & corrupt you are.",12337,2024-11-24 18:30:01,1
Declassified Cold War code-breaking manual has lessons for solving 'impossible' puzzles: https://phys.org/news/2021-05-declassified-cold-war-code-breaking-manual.html,12342,2024-12-09 14:30:02,1
#Bitcoin will be the world reserve currency within 10 years!,12345,2024-10-14 07:30:01,1
Some of you have never mined #bitcoin using a volcano and it shows.,12346,2024-11-27 07:30:01,1
We are now mining #bitcoin with volcanoes and you are still bearish.,12347,2024-10-12 18:30:01,1
"As more programmers build smart contracts on top of bitcoin's blockchain, there is the potential for #bitcoin to become more of a player in the world of DeFi, or decentralized finance.",12350,2024-11-15 08:30:02,1
"Most Bitcoin critics are from first world countries. They forget, others exists.",12351,2024-10-24 11:30:01,1
"After 10 years, 1 bitcoin will be worth 1 bitcoin.

Those who get it, get it.",12352,2024-12-26 14:30:01,1
The first best time to start building on bitcoin was over ten years ago. The second best time is now.,12353,2024-11-10 11:30:01,1
"Sidechains refuse to die because they are easy to spin up. Usually people spin them up to create a pitch deck overnight, raise money from virgin VC investors , and dump a token on retail.",12356,2024-12-16 18:30:01,1
Irish police to be given powers over passwords: https://www.bbc.com/news/world-europe-57468750,12379,2024-12-23 02:30:01,1
Start buying Bitcoin every week and do not stop. I don't care how uncomfortable it gets you must continue buying Bitcoin.,12381,2024-11-26 10:30:01,1
Start buying Monero every week and do not stop. I don't care how uncomfortable it gets you must continue buying Monero.,12382,2024-12-26 15:30:02,1
"Coinbase 5 years ago: We have a very strict vetting process for coins. You can buy 6 of the thousands. Fuck you.

Coinbase today: Let's pump SHIB to the moon. Still fuck you.",12383,2024-11-25 06:30:01,1
"The vast majority of competing layer 1's are just worse versions of Ethereum and Bitcoin.

But not your chain...that's special.",12384,2024-12-20 12:30:01,1
"Bitcoin's engineering ethos is fundamentally different from Ethereum's. 

Eth is like a tech company, moving fast, breaking things, pivoting and chasing user growth at all costs. 

Bitcoin is more intentional, focused on robustness, like a nuclear power plant operating system.",12385,2024-12-11 06:30:01,1
"The year is 2077, you're about to pay for a big villa on mars. You can now send BTC using your brain via neuralink.

The price for the house? 0.0004 $BTC",12387,2024-10-16 01:30:01,1
Satoshi Nakamoto should be awarded the Nobel Prize in Economics.,12388,2024-12-16 16:30:01,1
#Bitcoin secures the entire planet's monetary system by recycling 0.25% of its otherwise wasted energy.,12389,2024-10-31 03:30:02,1
"70% of people in El Salvador have no bank account.

But go on, continue criticizing their one chance for hope, #Bitcoin",12392,2024-12-05 17:30:02,1
"If you are pissing off both the IMF and the World bank then you are probably doing something right! 

#ElSalvador #bitcoin",12394,2024-12-13 15:30:01,1
"Harsh truth

You won't get life changing gains anymore with $BTC 
the 2011-now returns are misleading 

People in 2011 took a risk investing in a microcap 

To change your life you will need to invest in undervalued projects the mainstream are unaware of.

$CRYPTO $ALTS",12395,2024-11-20 20:30:02,1
"People still ask ""is cryptocurrency real?""

People don't ask ""is internet real?"" anymore.

Still early days.
",12398,2024-11-19 04:30:02,1
"Just remember now if you're shorting #Bitcoin, you're also shorting El Salvador.",12402,2024-10-27 03:30:01,1
"We took lightning, put it in a rock, and made it think",12403,2024-12-26 16:30:01,1
John McAfee didn't kill himself,12405,2024-11-28 03:30:02,1
"Crypto will replace all banks, fiat currencies and financial systems. There's nothing the corrupt and wicked can do to stop it.

Crypto is the ultimate disruption, our personal and collective superpower, a shift of control from the few to the many.",12406,2024-11-16 03:30:02,1
When #bitcoin hits the millions per coin we are going to see massive inflation in the price of private islands as bitcoiners look to build out citadel city's and start their own countries.,12407,2024-11-16 22:30:01,1
I had no idea John McAfee had dirt on Hillary Clinton,12408,2024-11-03 06:30:01,1
"Security features should be free. It's disgusting, embarrassing, and unethical for companies to charge more for security features such as SSO, MFA, data destruction, etc.",12424,2024-11-23 10:30:02,1
Cobalt Strike beacons are the cyber equivalent of Toyota Hilux pickups,12425,2024-11-29 03:30:01,1
"Good programmers write good code. 

Great programmers write no code. 

Zen programmers delete code.",12427,2024-10-20 22:30:01,1
"The UNIX legacy is a set of simple and timeless tools that can take years to master but which can perform seeming miracles in seconds in the hands of experienced users, sysadmins or developers.",12428,2024-11-26 16:30:01,1
80% of orgs that paid the ransom were hit again: https://venturebeat.com/2021/06/16/cybereason-80-of-orgs-that-paid-the-ransom-were-hit-again/,12429,2024-10-16 00:30:02,1
"Where do Russian hackers store their exploits? 

/ussr/bin/",12431,2024-10-21 09:30:01,1
"It takes about 600 lines of Python to send and receive #bitcoin. To send and receive dollars from scratch, you need an aircraft carrier and world domination.",12432,2024-12-21 18:30:01,1
"What Satoshi Nakamoto created with #Bitcoin is a theology of cryptography which guarantees privacy, and the ability to protect one's wealth beyond any physical power.",12433,2024-11-10 15:30:01,1
"The fact that so few of us are excited about the existence of a teleportable absolutely scarce resource, tells you something about the human race. #Bitcoin",12438,2024-12-17 09:30:02,1
40% of all dollars in existence were printed after #Bitcoin was created.,12439,2024-12-16 17:30:02,1
"Satoshi Nakamoto deserves the Nobel Prize, but has already declined it.

By staying anonymous, they've declined any recognition. Bringing financial freedom, sovereignty, and hope to billions around the world with #Bitcoin was enough of an award on its own for Satoshi Nakamoto.",12441,2024-12-07 14:30:01,1
I'm bullish on Monero.,12444,2024-12-14 00:30:01,1
"Gutenberg launched the printing press when 96% of the people in Europe were illiterate

That's how it feels to be building in crypto today 

It's just early",12446,2024-12-15 19:30:02,1
"2008: idea, 1 CPU = 1 vote

2024: mining becomes a geopolitical decision concerning monetary policy and the wealth of nations

There's a trajectory worth observing here. And I notice that #bitcoin is still only at 2% global adoption.",12452,2024-12-05 03:30:01,1
In another 10 years you will still feel that #Bitcoin is in its early days.,12453,2024-10-27 23:30:01,1
"Short version: ProtonMail is not secure. If you use ProtonMail and you attract the attention of a nation state, you will go to jail.",12458,2024-10-24 17:30:02,1
Nothing makes me more bullish about Bitcoin than listening to a bunch of old politicians.,12461,2024-12-22 20:30:01,1
"People will hold their 401ks for 40 years with 8% gains and never bat an eyes, but if bitcoin doesn't triple in value by next month they will sell.",12462,2024-12-22 08:30:01,1
"U.S government says crypto is volatile?

No, volatile is:

50% of Americans living paycheck to paycheck.

20% of all dollars in circulation being printed within the past year.

60% of small businesses closing permanently last year due to COVID.

Crypto is what brings stability.",12464,2024-10-05 21:30:02,1
All scientific articles should be free and accessible to everyone.,12465,2024-12-18 05:30:01,1
"Hackers Used to Be Humans. Soon, AIs Will Hack Humanity: https://www.wired.com/story/opinion-hackers-used-to-be-humans-soon-ais-will-hack-humanity/",12469,2024-10-06 07:30:02,1
"HTML - for structure
CSS - for style
Javascript - for fun
React - for work
C - for dinosaurs
C++ - for college
Swift - for UI
Ruby - for rails
jQuery - for legacy
Python - for science
Typescript - for safety
Java - for 3 billion devices",12472,2024-11-28 07:30:01,1
"Them: Can you just quickly pull this data for me?

Me: Sure, let me just: 

SELECT * FROM some_ideal_clean_and_pristine.table_that_you_think_exists",12473,2024-12-16 09:30:01,1
"What do you get when you SELECT * FROM goblins, dragons, elves, unicorns ?

A query tale",12474,2024-12-14 02:30:02,1
Decentralization matters,12489,2024-12-25 01:30:02,1
"It's all fun and games earning 128,000% staking a shitcoin until you realize that 128,000% of zero is... zero.",12491,2024-10-15 13:30:01,1
All the secrets of the world worth knowing are hidden in plain sight,12493,2024-12-04 06:30:02,1
"We've lost the internet, it's all about damage control now.",12495,2024-11-21 07:30:02,1
"Pop quiz: Which federal agency runs a clandestine social media surveillance unit known as the Internet Covert Operations Program (iCOP)?

If you guessed the FBI, the CIA, or the Department of Homeland Security - sorry. This one belongs to the U.S. Postal Service (USPS). ",12502,2024-10-04 17:30:01,1
"Google Assistant Records Audio Even When You're Not Using It, Company Reportedly Admits: https://www.techtimes.com/articles/262271/20210701/google-ai-assistant-records-company-admits.htm",12505,2024-10-29 11:30:01,1
"Reminder: Only around 14 Million BTC will ever be in circulation. Having 0.135 BTC will put you in the top 5%, forever.",12507,2024-11-27 22:30:01,1
"Steganography is just about concealing a message rather than encrypting it. In ancient Greece, a messengers head was shaved, message tattoo-ed on, hair grows back, messenger sent off, head shaved at other end, message read.",12510,2024-10-10 16:30:01,1
Bypassing Windows Hello Without Masks or Plastic Surgery: https://www.cyberark.com/resources/threat-research-blog/bypassing-windows-hello-without-masks-or-plastic-surgery,12516,2024-11-29 12:30:02,1
"when I say SYN, you say ACK",12518,2024-11-20 14:30:01,1
"The U.S. dollar is controlled by 12 people who have conversations and make decisions behind closed doors.

#Bitcoin is controlled by no one. Discussions are held out in the open and decisions are transparent and community-based. 

Which one do you think is the future of money?",12519,2024-10-31 17:30:01,1
"The Rich have money. 
The Wealthy have time. 
Bitcoiners have Freedom.",12520,2024-10-17 20:30:02,1
"DataUsage.sqlite is a file in an iTunes backup that records process names accessing the mobile data, as well as bytes uploaded and downloaded. Information can persist in here for *years* unless cleaned up.",12522,2024-12-09 17:30:01,1
"1 backup is no backups
2 backups is 1 backup
untested backups arent backups",12524,2024-10-19 05:30:01,1
Explicit is better than implicit. A little bit of boilerplate is better than not being able to understand your own code in a few months due to magic abstractions and syntactic sugar.,12526,2024-11-17 18:30:01,1
I have seen many asking on social media how they can stay safe from Pegasus spyware? The short answer is you can't. The NSO Group is sitting on a large number of 0days vulnerabilities. They actively purchase 0days too. It is one of the most dangerous tools out there.,12527,2024-10-04 01:30:01,1
Behind every good program is a frustrated programmer.,12528,2024-10-05 09:30:01,1
Apple iPhones were successfully hacked by NSO's Pegasus surveillance tool: https://www.washingtonpost.com/technology/2021/07/19/apple-iphone-nso/,12529,2024-10-22 04:30:01,1
Hiding Through a Maze of IoT Devices: https://blog.0day.rocks/hiding-through-a-maze-of-iot-devices-9db7f2067a80,12530,2024-12-06 12:30:01,1
More people use #Bitcoin in Nigeria than they do in the United States.,12531,2024-10-18 05:30:01,1
Decentralised finance will be synonymous with finance on a long enough time frame.,12532,2024-11-24 01:30:01,1
"Problem: You feel smarter than anybody else you meet.

Solution: Go to an Ethereum conference.",12533,2024-10-14 09:30:02,1
"How do you know if someone has lived through a crypto bear market?

Don't worry, they'll tell you.",12537,2024-12-22 10:30:01,1
Swiss bank issuing NFT shares in Picasso painting for $6K each: https://cointelegraph.com/news/master-pieces-swiss-bank-issuing-nft-shares-in-picasso-painting-for-6k-each,12538,2024-11-21 01:30:01,1
The FBI Is Locating Cars By Spying On Their WiFi: https://www.forbes.com/sites/thomasbrewster/2021/07/22/the-fbi-is-using-stingray-smartphone-surveillance-to-locate-cars-and-spy-on-their-wifi/,12540,2024-10-14 12:30:01,1
Everyday IT Tools Can Offer God Mode for Hackers: https://www.wired.com/story/it-management-tools-hacking-jamf-kaseya/,12544,2024-10-16 13:30:01,1
You have to go deep into the crypto rabbit hole to truely understand XMR. This is why its undervalued.,12548,2024-12-23 12:30:01,1
"Bought bitcoin? Good.

Now...
 - withdraw it to your own wallet (ASAP)
 - run to your own node
 - learn ways to enhance privacy, like CoinJoin
 - connect with bitcoiners at meetups, build trust
 - start a pseudonymous account, build reputation",12550,2024-11-26 02:30:02,1
"Leaving your bitcoin on an exchange is not only antithetical to the ethos of bitcoin it is irresponsible, reckless, and weakens the network by centralizing supply.

GTFO of EXCHANGES!",12551,2024-11-06 18:30:02,1
The Pentagon Is Bolstering Its AI Systems by Hacking Itself: https://www.wired.com/story/pentagon-bolstering-ai-systems-hacking-itself/,12553,2024-11-16 23:30:01,1
Pentagon believes its precognitive AI can predict events 'days in advance': https://www.engadget.com/pentagon-ai-predicts-days-in-advance-135509604.html,12554,2024-10-29 08:30:01,1
Using ProtonMail or Signal won't save you from targeted attacks. Encrypted messaging is why Pegasus exists and provides value for intel agencies.,12556,2024-12-28 06:30:01,1
"If your adversary has less bureaucracy than your organisation, the adversary is most probably winning",12557,2024-12-05 07:30:01,1
"Average folk should _not_ use a personal VPN. 
If you recommend personal VPNs you should:
1. Explain your threat model and expected adversaries
2. List vendors you trust, and _why_
3. Detail relevant vulnerabilities in OSs, browsers, apps
4. Explain what would change your mind",12558,2024-11-08 00:30:01,1
"Contrary to popular belief, Unix is user friendly. It just happens to be very selective about who it decides to make friends with.",12559,2024-10-29 22:30:01,1
"1 Write programs that do one thing and do it well. 

2 Write programs to work together. 

3 Write programs to handle text streams, because that is a universal interface.

- Unix philosophy by Doug McIlroy in the Bell System Technical Journal from 1978.",12560,2024-12-10 03:30:02,1
"Want to remove audio from your video file on Linux, macOS or Unix? Try

ffmpeg -i input.mp4 -c copy -an output.mp4

# Test it 
xdg-open output.mp4 # linux 
open output.mp4 # macos",12561,2024-11-18 23:30:01,1
Vampires use Linux because they don't like Windows in their house,12562,2024-10-09 14:30:02,1
"Job interviewer: So in your resume, it says you're a creative person.

Me: Yes

Job interviewer: What do you create?

Me: Technical debt",12563,2024-12-17 03:30:01,1
"You know what? FUCK IT. I am done. 

*continues to write the program*",12564,2024-10-19 07:30:01,1
"Do people even read the #Bitcoin whitepaper? 

Satoshi clearly wrote that ""the main benefits are lost if trusting a 3rd party"" - I agree with him 100%.",12565,2024-12-26 10:30:01,1
"""It might make sense just to get some in case it catches on."" ~ Satoshi Nakamoto",12566,2024-10-25 15:30:01,1
"Crypto is regulated by math, open-source and objective. Humans participate voluntarily.

Fiat is regulated by men, closed-source and subjective. Humans participate under coercion.

The next 10 years will be a volatile flow of humans from the latter to the former.",12567,2024-12-14 17:30:01,1
access to internet = access to DeFi,12568,2024-12-20 11:30:02,1
it's easier to use DeFi applications than sign into a bloomberg article,12569,2024-10-01 03:30:01,1
"Xerox Star was the first GUI OS... 

Apple and MS stole the concept from Xerox.",12570,2024-11-10 21:30:01,1
Facebook wants to crack WhatsApp encryption for ads: https://www.androidauthority.com/whatsapp-encryption-ads-2728774/,12573,2024-10-12 00:30:01,1
Hackers Turning to 'Exotic' Programming Languages for Malware Development: https://thehackernews.com/2021/07/hackers-turning-to-exotic-programming.html,12575,2024-10-07 20:30:01,1
DNA Is Millions of Times More Efficient Than Your Computer's Hard Drive: https://www.popularmechanics.com/science/a33327626/scientists-encoded-wizard-of-oz-in-dna,12577,2024-10-03 15:30:01,1
Secrets Hidden in Images (Steganography): https://www.youtube.com/watch?v=TWEXCYQKyDc,12580,2024-12-21 08:30:01,1
"So many rabbit holes to explore.
So little time.",12581,2024-11-24 09:30:02,1
How does gcc get compiled?,12582,2024-12-08 06:30:01,1
"""C programmers never die. They are just cast into void."" ~ Alan Perlis",12583,2024-10-04 18:30:01,1
"Remember you guys:

No matter what the price of #Bitcoin and #Ethereum is...

The technology stays the same!",12584,2024-11-14 02:30:01,1
"I was alive in the 1990s. I remember we had things like computers that weren't connected to the Internet, and photo albums that weren't subject to continuous real-time scanning. Society seemed... stable?",12586,2024-11-08 12:30:01,1
Linux distributions are just zodiac signs for nerds.,12587,2024-11-02 23:30:01,1
"Use Vim as your man page reader:

export MANPAGER=""vim -M +MANPAGER --not-a-term -""",12588,2024-12-22 21:30:02,1
"Friday prayer for Linux and Unix sysadmins:

1. May your top (or htop) statistics be low.

2. May you have unlimited resources on your cluster.

3. May your beard grow long and gray like Gandalf the gray*.

4. In the name of read-only Friday. Amen",12590,2024-10-01 09:30:01,1
"""Technically, Unix is a simple, coherent system which pushes a few good ideas to the limit."" ~  Sunil Das, computer scientist",12591,2024-12-07 10:30:02,1
"I was going to post a joke about HTTP 200, but it was just OK.",12592,2024-12-20 15:30:01,1
"""Some consider UNIX to be the second most important invention to come out of AT&T Bell Labs after the transistor."" ~ Dennis Ritchie, creator of the C programming language and co-creator of UNIX.",12593,2024-11-21 10:30:02,1
"The #Bitcoin Lightning Network's network capacity has reached $100 million in public channels.

Lightning is processing transactions at the speed of light, one million times more energy efficient than Visa, and open to the billions in the world without access to a bank account.",12594,2024-12-10 07:30:01,1
Wow soon $15m can't even get you a reasonably scarce jpeg much less a reasonably sized house,12595,2024-10-12 23:30:01,1
Scientists Just Simulated Quantum Technology on Classical Computing Hardware: https://www.sciencealert.com/quantum-circuits-simulated-on-classical-computers-test-the-limits-of-future-technology,12597,2024-12-11 05:30:01,1
Some consider UNIX to be the second most important invention to come out of AT&T Bell Labs after the transistor.,12599,2024-12-17 23:30:01,1
Chinese hackers disguised themselves as Iran to target Israel: https://www.technologyreview.com/2021/08/10/1031622/chinese-hackers-false-flag-iran-israel-fireeye/,12600,2024-11-15 10:30:01,1
"Linux is not supposed to be ""user friendly"", instead it should be ""user centric"".",12601,2024-11-06 10:30:01,1
"""If SHA-256 became completely broken, I think we could come to some agreement about what the honest block chain was before the trouble started, lock that in and continue from there with a new hash function."" ~ Satoshi Nakamoto",12603,2024-11-05 19:30:01,1
"""An evolving system increases its complexity unless work is done to reduce it."" ~ Meir Lehman",12604,2024-12-09 00:30:01,1
"""It's hard enough to find an error in your code when you're looking for it; it's even harder when you've assumed your code is error-free."" ~ Steve McConnell",12605,2024-11-19 18:30:01,1
"Programming is 10% science, 25% ingenuity and 65% getting the ingenuity to work with the science",12606,2024-11-05 18:30:01,1
"""Programming is the art of doing one thing at a time"" ~ Michael Feathers",12607,2024-10-10 06:30:01,1
"""Sometimes the elegant implementation is a function. Not a method. Not a class. Not a framework. Just a function."" ~ John Carmack",12608,2024-12-07 08:30:01,1
"""The purpose of software engineering is to control complexity, not to create it."" ~ Pamela Zave",12609,2024-11-24 12:30:01,1
All source code is open source if you can read assembly.,12610,2024-11-12 03:30:02,1
"""Every programmer is an author."" ~ Sercan Leyle",12611,2024-10-03 21:30:01,1
